index,url,valid,domain,title,description,image,published,archive,content,quote,language,keyword
https://www.huffingtonpost.fr/sport/article/suede-irak-rdc-voici-les-derniers-qualifies-pour-la-coupe-du-monde-2026-de-football_262164.html,https://www.huffingtonpost.fr/sport/article/suede-irak-rdc-voici-les-derniers-qualifies-pour-la-coupe-du-monde-2026-de-football_262164.html,0,www.huffingtonpost.fr,"Suède, Irak, RDC… Voici les derniers qualifiés pour la Coupe du monde 2026 de football","Pour le premier Mondial à 48 équipes, les qualifications ont offert des scénarios rocambolesques ; la Suède qui a composté son billet pour l’Amérique du Nord peut en témoigner.",https://focus.huffingtonpost.fr/2026/04/01/463/0/4942/2779/1820/1023/75/0/750b6b0_upload-1-1jbzpfksgwkc-afp-20260401-aa-01042026-2718987-v1-highres-rdcongovjamaica2026fifaworldcupqual.jpg,2026-04-01T10:13:01Z,,"EN BREFPour la première fois, la Coupe du monde verra 48 équipes daffronter dont les dernières se sont qualifiées ce mardi 31 mars.Le Cap-Vert, la Jordanie, lOuzbékistan et Curaçao joueront un Mondia… [+4214 chars]",,fr,'Irak'
https://www.huffingtonpost.fr/sport/article/coupe-du-monde-2026-sur-les-72-matches-du-premier-tour-10-affiches-a-ne-pas-rater_262161.html,https://www.huffingtonpost.fr/sport/article/coupe-du-monde-2026-sur-les-72-matches-du-premier-tour-10-affiches-a-ne-pas-rater_262161.html,0,www.huffingtonpost.fr,"Coupe du monde 2026 : sur les 72 matches du premier tour, 10 affiches à ne pas rater","On connaît depuis mardi soir les 48 pays qualifiés pour ce Mondial qui s’ouvrira dans un peu moins de deux mois et demi aux États-Unis, au Canada et au Mexique.",https://focus.huffingtonpost.fr/2026/04/01/331/0/5105/2871/1820/1023/75/0/0132318_upload-1-3atbmzjxx2d4-afp-20251205-2250186867-v3-highres-fifaworldcup2026officialdraw.jpg,2026-04-01T12:56:31Z,,"La photo de départ est désormais complète. Six derniers pays - Bosnie-Herzégovine, Suède, Turquie, République Tchèque, République démocratique du Congo et Irak - se sont qualifiés mardi 31 mars pour … [+5503 chars]",,fr,'Turquie'
https://www.begeek.fr/proton-vpn-la-confidentialite-sinvite-en-amerique-latine-430334,https://www.begeek.fr/proton-vpn-la-confidentialite-sinvite-en-amerique-latine-430334,0,www.begeek.fr,Proton VPN : la confidentialité s’invite en Amérique latine,"Les abonnés payants peuvent désormais se connecter localement depuis Bolivie, Haïti, Jamaïque, Paraguay et Uruguay.",https://www.begeek.fr/app/uploads/2026/01/Proton-VPN-1.jpg,2026-04-02T08:00:53Z,,"Les abonnés payants peuvent désormais se connecter localement depuis Bolivie, Haïti, Jamaïque, Paraguay et Uruguay.
Tl;dr
<ul><li>Proton VPN étend son réseau à cinq nouveaux pays dAmérique latine e… [+2847 chars]",,fr,'Uruguay'
https://www.20minutes.fr/monde/ukraine/4216479-20260402-guerre-ukraine-armee-russe-multiplie-attaques-drones-gagne-plus-moindre-metre-terrain,https://www.20minutes.fr/monde/ukraine/4216479-20260402-guerre-ukraine-armee-russe-multiplie-attaques-drones-gagne-plus-moindre-metre-terrain,0,www.20minutes.fr,Guerre en Ukraine : L’armée russe multiplie les attaques de drones mais ne gagne plus le moindre mètre de terrain,"« 20 Minutes » fait le point pour vous tous les soirs sur le conflit en Ukraine. Ce jeudi, 1.499e jour du conflit, la journée a été marquée par le coup d’arrêt de la Russie sur le front",https://img.20mn.fr/LUp35aajQeGrFVe8rcGVsyk/1444x920_les-sauveteurs-ukrainiens-s-efforcent-d-eteindre-un-incendie-dans-un-batiment-residentiel-endommage-a-la-suite-d-une-attaque-de-drone-a-kharkiv-le-2-avril-2026-dans-le-cadre-de-l-invasion-russe-de-l-ukraine-photo-de-sergey-bobok-afp,2026-04-02T18:01:46Z,http://web.archive.org/web/20260403015224/https://www.20minutes.fr/monde/ukraine/4216479-20260402-guerre-ukraine-armee-russe-multiplie-attaques-drones-gagne-plus-moindre-metre-terrain,"Vous avez raté les derniers événements sur la guerre en Ukraine ? 20 Minutes fait le point pour vous tous les soirs. Voici lessentiel de ce jeudi 2 avril 2026, au 1.499e jour du conflit.
Le fait du … [+3775 chars]",,fr,'Turquie'
https://www.mediapart.fr/journal/international/030426/turquie-le-proces-d-ekrem-imamoglu-symbole-de-la-criminalisation-de-l-opposition,https://www.mediapart.fr/journal/international/030426/turquie-le-proces-d-ekrem-imamoglu-symbole-de-la-criminalisation-de-l-opposition,0,www.mediapart.fr,"Turquie: le procès d’Ekrem Imamoğlu, symbole de la criminalisation de l’opposition","Le procès du maire d’Istanbul, principal rival du président islamo-nationaliste Recep Tayyip Erdoğan, s’est ouvert début mars à proximité de la prison où il est détenu. Tandis que les menaces de toutes sortes pleuvent contre son parti, le CHP, un autre maire …",https://static.mediapart.fr/etmagine/og/journal/files/2026/04/03/260403-img-en-turquie-le-pouvoir-lance-une-deferlante-judiciaire-sur-l-opposition.jpg,2026-04-03T12:57:27Z,,"Les cookies et technologies similaires que nous utilisons sur Mediapart sont de différentes natures et nous permettent de poursuivre différentes finalités. 
Certains sont nécessaires au fonctionneme… [+3291 chars]",,fr,'Turquie'
