index,url,valid,domain,title,description,image,published,archive,content,quote,language,keyword
https://www.ledauphine.com/economie/2026/06/29/le-pari-de-la-start-up-yanaa-pour-une-nutrition-salee,https://www.ledauphine.com/economie/2026/06/29/le-pari-de-la-start-up-yanaa-pour-une-nutrition-salee,0,www.ledauphine.com,Annecy. « On entend depuis 50 ans qu’il faut du sucre pour avoir de l’énergie » : la start-up Yanaa propose aux sportifs une nutrition... salée,"« Si l’on regarde en arrière, on peut se dire que l’on s’est lancé dans un segment qui était complètement contre-intuitif par rapport à ce qui existait.",https://cdn-s-www.ledauphine.com/images/05036611-7984-4B13-888E-330D933FF987/FB1200/photo-1782726908.jpg,2026-07-01T04:05:00Z,http://web.archive.org/web/20260702011850/https://www.ledauphine.com/economie/2026/06/29/le-pari-de-la-start-up-yanaa-pour-une-nutrition-salee,"Le Dauphiné Libéré, en tant que responsable de traitement, recueille dans ce formulaire des informations qui sont enregistrées dans un fichier informatisé par son Service Relations Clients, la finali… [+854 chars]",,fr,'Annecy'
https://www.ledauphine.com/faits-divers-justice/2026/07/01/leurs-filles-de-cinq-ans-avaient-subi-des-agressions-sexuelles-au-periscolaire,https://www.ledauphine.com/faits-divers-justice/2026/07/01/leurs-filles-de-cinq-ans-avaient-subi-des-agressions-sexuelles-au-periscolaire,0,www.ledauphine.com,Savoie. Leurs filles de cinq ans avaient subi des agressions sexuelles au périscolaire,"Trois mois après qu’un stagiaire mineur a été reconnu coupable d’agressions sexuelles sur leurs enfants dans un accueil périscolaire de Grésy-sur-Aix, trois familles ont choisi de témoigner pour sensibiliser les autres parents.",https://cdn-s-www.ledauphine.com/images/FDDC0669-5589-45ED-8CDD-EDD053B26839/FB1200/photo-1782900551.jpg,2026-07-01T10:19:00Z,http://web.archive.org/web/20260702070009/https://www.ledauphine.com/faits-divers-justice/2026/07/01/leurs-filles-de-cinq-ans-avaient-subi-des-agressions-sexuelles-au-periscolaire,"Un an et demi après les faits, trois mois après laudience du tribunal pour enfants, ces trois familles ont voulu prendre la parole « pour que nos histoires servent à dautres parents, pour quils soien… [+627 chars]",,fr,'Savoie'
https://france3-regions.franceinfo.fr/auvergne-rhone-alpes/haute-savoie/deux-enfants-de-8-et-13-ans-disparaissent-aux-abords-de-l-hopital-d-annecy-la-gendarmerie-particulierement-inquiete-lance-des-appels-a-temoins-3379120.html,https://france3-regions.franceinfo.fr/auvergne-rhone-alpes/haute-savoie/deux-enfants-de-8-et-13-ans-disparaissent-aux-abords-de-l-hopital-d-annecy-la-gendarmerie-particulierement-inquiete-lance-des-appels-a-temoins-3379120.html,0,france3-regions.franceinfo.fr,"Deux enfants de 8 et 13 ans disparaissent aux abords de l'hôpital d'Annecy : la gendarmerie, ""particulièrement inquiète"", lance des appels à témoins","La gendarmerie de la Haute-Savoie a diffusé ce mercredi 1er juillet, deux appels à témoins. Deux mineurs, l’un âgé de 8 ans, l’autre de 13 ans sont activement recherchés, après une fugue survenue à Épagny Metz-Tessy (Haute-Savoie) aux abords du centre hospita…",https://france3-regions.franceinfo.fr/image/Ew0MCb4kaTKCm6ApmIHJvySOIDU/930x620/regions/2026/07/01/6a44ef4ddee0f946319792.jpg,2026-07-01T10:57:26Z,http://web.archive.org/web/20260701130637/https://france3-regions.franceinfo.fr/auvergne-rhone-alpes/haute-savoie/deux-enfants-de-8-et-13-ans-disparaissent-aux-abords-de-l-hopital-d-annecy-la-gendarmerie-particulierement-inquiete-lance-des-appels-a-temoins-3379120.html,"La gendarmerie de la Haute-Savoie a diffusé ce mercredi 1er juillet, deux appels à témoins. Deux mineurs, lun âgé de 8 ans, lautre de 13 ans sont activement recherchés, après une fugue survenue à Épa… [+1037 chars]",,fr,'Annecy'
https://www.ledauphine.com/faits-divers-justice/2026/07/01/disparition-inquietante-de-deux-mineurs-de-8-et-13-ans-en-fugue-un-double-appel-a-temoins-lance,https://www.ledauphine.com/faits-divers-justice/2026/07/01/disparition-inquietante-de-deux-mineurs-de-8-et-13-ans-en-fugue-un-double-appel-a-temoins-lance,0,www.ledauphine.com,Haute-Savoie. Disparition inquiétante de deux mineurs de 8 et 13 ans en fugue : un double appel à témoins lancé,"Vive inquiétude, à Épagny Metz-Tessy, après la disparition de deux mineurs âgés de 8 et 13 ans. En fugue, les deux jeunes garçons prénommés Even ...",https://cdn-s-www.ledauphine.com/images/FBED8F57-FC6C-4C50-BC7F-318029CFC871/FB1200/photo-1782906552.jpg,2026-07-01T11:51:00Z,,"Vive inquiétude, à Épagny Metz-Tessy, après la disparition de deux mineurs âgés de 8 et 13 ans. En fugue, les deux jeunes garçons prénommés Even et Logan ont été aperçus ensemble aux abords du centre… [+1475 chars]",,fr,'Annecy'
https://www.ledauphine.com/environnement/2026/07/01/on-a-entendu-un-drole-de-bruit-comme-un-grondement-une-coulee-de-boue-coupe-la-route-de-beffay-a-glieres-val-de-borne,https://www.ledauphine.com/environnement/2026/07/01/on-a-entendu-un-drole-de-bruit-comme-un-grondement-une-coulee-de-boue-coupe-la-route-de-beffay-a-glieres-val-de-borne,0,www.ledauphine.com,"Haute-Savoie. « On a entendu un drôle de bruit, comme un grondement » : une coulée de boue coupe la route de Beffay à Glières-Val-de-Borne",Le violent orage et les pluies diluviennes de ce mercredi 1er  juillet en journée n’ont pas été sans conséquences à Glières-Val-de-Borne : le torrent a débordé sur la route de Beffay aux alentours de 12 h 30.,https://cdn-s-www.ledauphine.com/images/4F105BAD-FB3B-4CC0-BD9D-EF9D9FF9CFE5/FB1200/photo-1782910398.jpg,2026-07-01T12:41:00Z,http://web.archive.org/web/20260702051108/https://www.ledauphine.com/environnement/2026/07/01/on-a-entendu-un-drole-de-bruit-comme-un-grondement-une-coulee-de-boue-coupe-la-route-de-beffay-a-glieres-val-de-borne,Le violent orage et les pluies diluviennes de ce mercredi 1er  juillet en journée n’ont pas été sans conséquences à Glières-Val-de-Borne : le torrent a débordé sur la route de Beffay aux alentours de… [+1421 chars],,fr,'Savoie'
https://www.courrierinternational.com/article/coupe-du-monde-face-a-la-belgique-les-lions-prets-a-rugir-s-enthousiasme-la-presse-senegalaise_245941,https://www.courrierinternational.com/article/coupe-du-monde-face-a-la-belgique-les-lions-prets-a-rugir-s-enthousiasme-la-presse-senegalaise_245941,0,www.courrierinternational.com,"Face à la Belgique, “les Lions prêts à rugir”, s’enthousiasme la presse sénégalaise","Tout en saluant la qualité de la sélection belge, la presse sénégalaise exhorte les Lions à offrir du rêve et à continuer d’écrire l’histoire, après avoir décroché une 2e étoile en Coupe d'Afrique des nations en janvier.",https://focus.courrierinternational.com/2026/07/01/1/0/1280/853/1200/630/60/0/0f530f2_upload-1-fyrafmw0eq1q-unes-se-ne-gal-coupedumonde.jpg,2026-07-01T14:58:41Z,,"Il est des affiches qui sentent la peur. Dautres qui sentent loccasion. Belgique-Sénégal appartient aux deux catégories, écrit le quotidien sénégalais LObservateur mercredi 1er juillet, quelques heur… [+1698 chars]",,fr,'Belge'
https://www.ledauphine.com/economie/2026/07/01/francois-excoffier-quitte-son-poste-de-pdg-d-excoffier-recyclage,https://www.ledauphine.com/economie/2026/07/01/francois-excoffier-quitte-son-poste-de-pdg-d-excoffier-recyclage,0,www.ledauphine.com,Haute-Savoie. François Excoffier quitte son poste de PDG d’Excoffier Recyclage,"C’est une entreprise 100 % familiale qui l’est restée depuis sa création en 1971 à Groisy. Leader du recyclage en Haute-Savoie, Excoffier ...",https://cdn-s-www.ledauphine.com/images/4DB1592F-F11C-44CE-A5EA-D82D3B03AE73/FB1200/photo-1782919122.jpg,2026-07-01T15:23:00Z,,"Le Dauphiné Libéré, en tant que responsable de traitement, recueille dans ce formulaire des informations qui sont enregistrées dans un fichier informatisé par son Service Relations Clients, la finali… [+854 chars]",,fr,'Savoie'
https://www.mediapart.fr/journal/ecologie/010726/jo-2030-est-ce-qu-veut-gaspiller-toutes-les-ressources-ou-participer-la-transition,https://www.mediapart.fr/journal/ecologie/010726/jo-2030-est-ce-qu-veut-gaspiller-toutes-les-ressources-ou-participer-la-transition,0,www.mediapart.fr,JO 2030: «Est-ce qu’on veut gaspiller toutes les ressources ou participer à la transition?»,"Alors même que plusieurs sites en Savoie disposent déjà de pistes de ski acrobatique, le comité d’organisation des JO 2030 projette de sacrifier des zones naturelles pour en aménager dans le Briançonnais. Des athlètes déplorent ces choix.",https://static.mediapart.fr/etmagine/og/journal/files/2026/07/01/jo-2030-est-ce-qu-veut-gaspiller-toutes-les-ressources-ou-participer-la-transition.jpg,2026-07-01T15:37:59Z,http://web.archive.org/web/20260701221331/https://www.mediapart.fr/journal/ecologie/010726/jo-2030-est-ce-qu-veut-gaspiller-toutes-les-ressources-ou-participer-la-transition,"Les cookies et technologies similaires que nous utilisons sur Mediapart sont de différentes natures et nous permettent de poursuivre différentes finalités. 
Certains sont nécessaires au fonctionneme… [+3291 chars]",,fr,'Savoie'
https://www.lejournaldesentreprises.com/article/la-maison-de-luxe-alsacienne-norki-etend-son-reseau-de-boutiques-de-deco-et-dameublement-en-suisse-2145965,https://www.lejournaldesentreprises.com/article/la-maison-de-luxe-alsacienne-norki-etend-son-reseau-de-boutiques-de-deco-et-dameublement-en-suisse-2145965,0,www.lejournaldesentreprises.com,La maison de luxe alsacienne Norki étend son réseau de boutiques de déco et d’ameublement en Suisse,"Créée il y a 15 ans, la maison Norki s’est imposée sur le secteur du luxe en créant divers objets de décoration et d’ameublement à base de peaux et de fourrures animales. Un développement et une visibilité qui doit beaucoup au positionnement de la PME alsacie…",https://www.lejournaldesentreprises.com/sites/lejournaldesentreprises.com/files/styles/landscape_web_lg_2x/public/2026-07/tablie--Molsheim-dans-le-Bas-Rhin-la-Maison-N-22349479.jpeg?h=22744819&itok=JumojBVk,2026-07-01T16:09:41Z,,"Comment transposer un savoir-faire familial et artisanal vers une marque faisant désormais office de référence dans les secteurs du luxe et de la décoration dintérieur ? Établie à Molsheim, dans le B… [+3118 chars]",,fr,'Suisse'
https://france3-regions.franceinfo.fr/auvergne-rhone-alpes/haute-savoie/des-habitants-de-scionzier-prives-d-eau-potable-apres-un-violent-orage-une-citerne-mise-en-place-pour-approvisionner-la-population-3379339.html,https://france3-regions.franceinfo.fr/auvergne-rhone-alpes/haute-savoie/des-habitants-de-scionzier-prives-d-eau-potable-apres-un-violent-orage-une-citerne-mise-en-place-pour-approvisionner-la-population-3379339.html,0,france3-regions.franceinfo.fr,Des habitants de Scionzier privés d'eau potable après un violent orage : une citerne mise en place pour approvisionner la population,"Un violent orage a touché la source d'eau potable de Scionzier, en Haute-Savoie, rendant l'eau potable impropre à la consommation depuis cinq jours dans une partie de la commune. La mairie va installer une citerne pour permettre aux habitants de s'approvision…",https://france3-regions.franceinfo.fr/image/CYvJKSwPoZnyuzfCONBd9uaax0o/930x620/regions/2026/07/01/6a4537a1367b4016454103.jpg,2026-07-01T16:17:58Z,,"Un violent orage a touché la source d'eau potable de Scionzier, en Haute-Savoie, rendant l'eau potable impropre à la consommation depuis cinq jours dans une partie de la commune. La mairie va install… [+2170 chars]",,fr,'Savoie'
https://www.ledauphine.com/economie/2026/07/01/quand-l-eau-potable-se-fait-rare-ce-village-s-impose-des-restrictions,https://www.ledauphine.com/economie/2026/07/01/quand-l-eau-potable-se-fait-rare-ce-village-s-impose-des-restrictions,0,www.ledauphine.com,"Haute-Savoie. « Pas d’autres choix que de procéder à une coupure d’eau en urgence » : quand l’eau potable se fait rare, ce village s’impose des restrictions","En pleine canicule, la mairie de Contamine-Sarzin a informé ses habitants d’une coupure d’eau générale, en raison d’une consommation trop importante compte tenu des restrictions en vigueur. Une situation qui tendra à se reproduire sans une prise de conscience…",https://cdn-s-www.ledauphine.com/images/60B9410B-936F-4F2A-A538-1E2C0244B08F/FB1200/photo-1782923696.jpg,2026-07-01T17:40:00Z,http://web.archive.org/web/20260702030104/https://www.ledauphine.com/economie/2026/07/01/quand-l-eau-potable-se-fait-rare-ce-village-s-impose-des-restrictions,"“La situation est critique. Malgré les restrictions préfectorales, de nombreux abus ont été constatés toute la semaine. La commune n’a plus d’autres choix que de procéder à une coupure d’eau en urgen… [+571 chars]",,fr,'Savoie'
https://www.ledauphine.com/culture-loisirs/2026/07/01/987-metres-de-long-pour-120-metres-de-denivele-la-plus-longue-tyrolienne-a-virages-d-europe-ouvre-samedi-en-savoie,https://www.ledauphine.com/culture-loisirs/2026/07/01/987-metres-de-long-pour-120-metres-de-denivele-la-plus-longue-tyrolienne-a-virages-d-europe-ouvre-samedi-en-savoie,0,www.ledauphine.com,Loisirs. 987 mètres de long pour 120 mètres de dénivelé : la plus longue tyrolienne à virages d’Europe ouvre samedi en Savoie,"C’est un équipement de loisirs relativement rare en France. Une tyrolienne à virages ouvre, ce samedi, à Saint-Sorlin-d’Arves, en Maurienne. Une activité originale, accessible à (presque) toute la famille et qui procure des sensations uniques. La SlalomFly, c…",https://cdn-s-www.ledauphine.com/images/42D34D66-5FAD-431F-9FA1-D5C7DC160FAB/FB1200/photo-1782931371.jpg,2026-07-01T17:52:00Z,http://web.archive.org/web/20260702050124/https://www.ledauphine.com/culture-loisirs/2026/07/01/987-metres-de-long-pour-120-metres-de-denivele-la-plus-longue-tyrolienne-a-virages-d-europe-ouvre-samedi-en-savoie,"À la sortie de Saint-Sorlin-dArves, au bord des premiers virages du col de la Croix de Fer se dressent détranges pylônes de métal. Il ne sagit pas là dune nouvelle remontée mécanique, mais dune infra… [+595 chars]",,fr,'France'
https://www.courrierinternational.com/article/football-entre-disneyland-et-la-rome-antique-le-sofi-stadium-est-l-eldorado-du-divertissement-americain_245711,https://www.courrierinternational.com/article/football-entre-disneyland-et-la-rome-antique-le-sofi-stadium-est-l-eldorado-du-divertissement-americain_245711,0,www.courrierinternational.com,"Entre Disneyland et la Rome antique, le SoFi Stadium est l’eldorado du divertissement américain","Le stade situé à Inglewood, dans le comté de Los Angeles, en Californie, est indéniablement le plus beau de la Coupe du monde 2026 aux États-Unis. Il accueillera Espagne-Autriche en seizièmes de finale, ce jeudi 2 juillet. “11 Freunde”, magazine allemand cons…",https://focus.courrierinternational.com/2026/07/01/0/0/5565/3710/1200/630/60/0/bdb2a9d_ftp-1-2ytrlesqbbsx-2284103660.jpg,2026-07-02T03:00:18Z,,"Alignées comme à la parade au bord du lac artificiel, à lendroit précis où une petite cascade de 50 centimètres de haut anime le bassin, des mouettes accueillent le visiteur qui pénètre dans lenceint… [+1085 chars]",,fr,'Espagne'
https://www.huffingtonpost.fr/sport/article/la-fin-du-match-qui-a-permis-aux-belges-de-battre-le-senegal-etait-simplement-miraculeuse_281954.html,https://www.huffingtonpost.fr/sport/article/la-fin-du-match-qui-a-permis-aux-belges-de-battre-le-senegal-etait-simplement-miraculeuse_281954.html,0,www.huffingtonpost.fr,La fin du match qui a permis aux Belges de battre le Sénégal était simplement miraculeuse,"Après avoir longtemps été menée 2-0, la Belgique a remonté un retard de deux buts pour s’imposer face au Sénégal au terme de la prolongation et se hisser en huitièmes de finale.",https://focus.huffingtonpost.fr/2026/07/02/277/0/5329/2997/1820/1023/75/0/a0291e4_upload-1-vl6t0yu59e9k-afp-20260701-2284228651-v1-highres-belgiumvsenegalroundof32fifaworldcup2026-2.jpg,2026-07-02T05:18:07Z,,"In extremis. La Belgique a arraché mercredi 1er juillet sa qualification pour les 8e de finale du Mondial en battant le Sénégal grâce à un pénalty transformé en toute fin de prolongation (3-2).
Alor… [+3253 chars]",,fr,'Belge'
https://www.journaldugeek.com/2026/07/02/moustique-tigre-voici-les-endroits-en-france-a-bannir-pour-eviter-les-piqures/,https://www.journaldugeek.com/2026/07/02/moustique-tigre-voici-les-endroits-en-france-a-bannir-pour-eviter-les-piqures/,0,www.journaldugeek.com,Moustique tigre : voici les endroits en France à bannir pour éviter les piqûres,"Le cauchemar de vos étés est de retour, et il ne s'agit pas de la canicule.",https://www.journaldugeek.com/app/uploads/2026/07/moustique-tigre-1600x900.jpg,2026-07-02T06:00:35Z,,"En 2004, les moustiques tigres ne s’étaient implantés que dans un seul département français. Vingt-deux ans plus tard, il en occupe 81, soit 84 % du territoire métropolitain. La progression a été rap… [+2389 chars]",,fr,'France'
https://www.telerama.fr/arts-expositions/les-meilleures-expos-gratuites-a-voir-a-paris-en-juillet-2026-4242-7029217.php,https://www.telerama.fr/arts-expositions/les-meilleures-expos-gratuites-a-voir-a-paris-en-juillet-2026-4242-7029217.php,0,www.telerama.fr,Les meilleures expos gratuites à voir à Paris en juillet 2026,"La peinture par points de l’artiste aborigène Konstantina, les toiles débordantes de vie d’Emmanuel Awuni, un campement de fortune dans le désert californien photographié par Laura Henno… Notre sélection d’expos en accès libre, mise à jour chaque semaine.",https://focus.telerama.fr/2026/06/29/48/0/3196/2130/1200/800/60/0/e42f9c8_upload-1-2ubytaxq7l3d-4951-konstantina-arts-d-australie-ste-phane-jacob.jpg,2026-07-02T07:42:42Z,,"Pour soutenir le travail de toute une rédaction, abonnez-vousPourquoi voyez-vous ce message ?
 Vous avez choisi de ne pas accepter le dépôt de ""cookies"" sur votre navigateur, qui permettent notammen… [+616 chars]",,fr,'Paris'
https://www.globenewswire.com/news-release/2026/07/02/3321129/0/fr/D%C3%A9claration-du-nombre-total-de-droits-de-vote-et-d-actions-composant-le-capital-social-de-74Software-au-30-juin-2026.html,https://www.globenewswire.com/news-release/2026/07/02/3321129/0/fr/D%C3%A9claration-du-nombre-total-de-droits-de-vote-et-d-actions-composant-le-capital-social-de-74Software-au-30-juin-2026.html,0,www.globenewswire.com,Déclaration du nombre total de droits de vote et d’actions composant le capital social de 74Software au 30 juin 2026,"Communiqué de presse  Déclaration du nombre total de droits de vote et d’actions composant le capital social de 74Software au 30 juin 2026  Paris, le 2...",https://ml-eu.globenewswire.com/Resource/Download/d76686e2-b26d-4fc8-8254-0edf1213c6a7,2026-07-02T08:00:00Z,,"Communiqué de presse
Déclaration du nombre total de droits de vote et dactions composant le capital social de 74Software au 30 juin 2026
Paris, le 2 juillet 2026 Conformément aux articles L.233-8 I… [+1951 chars]",,fr,'Paris'
https://www.telerama.fr/musique/enrique-mazzola-a-l-opera-de-paris-un-chef-lyrique-doit-avoir-les-yeux-et-les-oreilles-partout-7031884.php,https://www.telerama.fr/musique/enrique-mazzola-a-l-opera-de-paris-un-chef-lyrique-doit-avoir-les-yeux-et-les-oreilles-partout-7031884.php,0,www.telerama.fr,Enrique Mazzola à l’Opéra de Paris : “Un chef lyrique doit avoir les yeux et les oreilles partout ”,"Le plus français des chefs italiens revient à Paris après sept ans d’absence pour diriger “La Cenerentola”, le fascinant opéra de Rossini, à Garnier. Une première dans la fosse de l’institution parisienne. À voir les 2, 8 et 11 juillet.",https://focus.telerama.fr/2026/06/19/181/304/2484/1656/1200/800/60/0/e14ae9f_upload-1-ienfo0j0ajhx-telerama-005882-010.jpg,2026-07-02T08:00:16Z,,"Le plus français des chefs italiens revient à Paris après sept ans dabsence pour diriger La Cenerentola, le fascinant opéra de Rossini, à Garnier. Une première dans la fosse de linstitution parisienn… [+7409 chars]",,fr,'Paris'
https://www.bfmtv.com/culture/musique/invites-chansons-surprises-les-temps-forts-du-concert-de-bad-bunny-a-marseille_AN-202607020401.html,https://www.bfmtv.com/culture/musique/invites-chansons-surprises-les-temps-forts-du-concert-de-bad-bunny-a-marseille_AN-202607020401.html,0,www.bfmtv.com,"Invités, chansons surprises,... Les temps forts du concert de Bad Bunny à Marseille","Pour le premier de ses trois concerts en France, ce mercredi 1er juillet, la star portoricaine a fait danser les 65.000 spectateurs du stade Vélodrome de Marseille au rythme de ses plus grands tubes.",https://images.bfmtv.com/KjtGFPQ-hKuAq3VTz-f_rJJDSnk=/0x8:2048x1160/2048x0/images/Le-chanteur-portoricain-Bad-Bunny-en-concert-au-velodrome-de-Marseille-le-1er-juillet-2026-2313815.jpg,2026-07-02T08:09:29Z,http://web.archive.org/web/20260702090709/https://www.bfmtv.com/culture/musique/invites-chansons-surprises-les-temps-forts-du-concert-de-bad-bunny-a-marseille_AN-202607020401.html,"Pour le premier de ses trois concerts en France, ce mercredi 1er juillet, la star portoricaine a fait danser les 65.000 spectateurs du stade Vélodrome de Marseille au rythme de ses plus grands tubes.… [+2370 chars]",,fr,'France'
https://www.lavenir.net/regions/luxembourg/sports/2026/07/02/le-messanceen-fabrice-poncelet-a-suivi-les-trois-premieres-rencontres-des-diables-aux-usa-le-cout-entre-2500-et-3000-BLERVT65OFDX5NRIB5TBGQEZUI/,https://www.lavenir.net/regions/luxembourg/sports/2026/07/02/le-messanceen-fabrice-poncelet-a-suivi-les-trois-premieres-rencontres-des-diables-aux-usa-le-cout-entre-2500-et-3000-BLERVT65OFDX5NRIB5TBGQEZUI/,0,www.lavenir.net,"Le Messancéen Fabrice Poncelet a suivi les trois premières rencontres des Diables aux USA: ""Le coût? Entre 2500 et 3000€""","Fabrice Poncelet a traversé l’Atlantique avec des amis des Reds Messancy et Diabolux pour encourager Meunier, Castagne et consorts. ...",https://www.lavenir.net/resizer/v2/O5IHLZWXPBH4RFTI4KATVBNFWY.jpg?auth=1531b670331239deb63337fa3f4a33b7d6b61f58e0be4827bec1707307ffae5d&width=1200&height=630&quality=85&focal=550%2C412,2026-07-02T08:29:00Z,,"""C'est ma cinquième Coupe du Monde, le football et visiter des villes, c'est ma passion, avance""Ponpon"". J'adore les États-Unis. Je m'y étais déjà rendu lors du Mondial 1994 et j'avais effectué le dé… [+2375 chars]",,fr,'Paris'
https://www.globenewswire.com/news-release/2026/07/02/3321135/0/fr/Bilan-semestriel-du-contrat-de-liquidit%C3%A9-Du-1er-janvier-au-30-juin-2026.html,https://www.globenewswire.com/news-release/2026/07/02/3321135/0/fr/Bilan-semestriel-du-contrat-de-liquidit%C3%A9-Du-1er-janvier-au-30-juin-2026.html,0,www.globenewswire.com,Bilan semestriel du contrat de liquidité - Du 1er janvier au 30 juin 2026,"BILAN SEMESTRIEL DU CONTRAT DE LIQUIDITE DE LA SOCIETE NEXANS  _COMMUNIQUÉ DE PRESSE_  Paris, le 2 juillet 2026 – Au titre du contrat de liquidité...",https://ml-eu.globenewswire.com/Resource/Download/6992f746-d04a-47c1-ab56-c4f47722dd9a,2026-07-02T08:40:00Z,,"BILAN SEMESTRIEL DU CONTRAT DE LIQUIDITE DE LA SOCIETE NEXANS
_COMMUNIQUÉ DE PRESSE_
Paris, le 2 juillet 2026 Au titre du contrat de liquidité confié par NEXANS SA à NATIXIS ODDO BHF, les ressource… [+2834 chars]",,fr,'Paris'
https://www.journaldugeek.com/2026/07/02/discretement-canal-retire-trois-chaines-tf1-de-son-offre-en-france/,https://www.journaldugeek.com/2026/07/02/discretement-canal-retire-trois-chaines-tf1-de-son-offre-en-france/,0,www.journaldugeek.com,"Discrètement, Canal+ retire trois chaînes TF1 de son offre en France","Depuis le 1er juillet, trois chaînes du groupe TF1 ont disparu des offres Canal+ en France et en Suisse. En Afrique, ce sont les sept antennes qui s'éteignent d'un coup.",https://www.journaldugeek.com/app/uploads/2026/07/TV-1600x900.jpg,2026-07-02T09:00:46Z,http://web.archive.org/web/20260702121003/https://www.journaldugeek.com/2026/07/02/discretement-canal-retire-trois-chaines-tf1-de-son-offre-en-france/,"Cette semaine, certains abonnés Canal+ ont allumé leur télé, et sont tombés sur du vide. Cette fois, il ne s’agit ni d’une panne, ni d’un bug de décodeur, mais bien d’une décision commerciale, prise … [+3196 chars]",,fr,'Suisse'
https://www.franceinfo.fr/faits-divers/police/le-parquet-annonce-saisir-l-igpn-d-une-enquete-pour-violences-ayant-entraine-la-mort-apres-le-deces-d-une-femme-survenant-apres-des-tirs-policiers-a-paris_8089841.html,https://www.franceinfo.fr/faits-divers/police/le-parquet-annonce-saisir-l-igpn-d-une-enquete-pour-violences-ayant-entraine-la-mort-apres-le-deces-d-une-femme-survenant-apres-des-tirs-policiers-a-paris_8089841.html,0,www.franceinfo.fr,Une enquête pour violences ayant entraîné la mort confiée à l'IGPN après le décès d'une femme à la suite de tirs policiers à Paris,"Selon les premiers éléments transmis au parquet, la victime a ""subitement agressé"" une policière en ""effectuant de grands gestes avec un couteau de boucher"" et un fonctionnaire a alors ""fait usage de son arme à feu"".",https://www.franceinfo.fr/pictures/obhOpA76wZDZRmN3gtJGmK2NZlw/0x53:1024x629/1500x843/2026/07/02/6a46272c92828440351524.jpg,2026-07-02T09:11:41Z,,"Le parquet de Paris a annoncé, jeudi 2 juillet à l'AFP, l'ouverture d'une enquête pour violences ayant entraîné la mort, confiée à l'Inspection générale de la police nationale (IGPN), après le décès … [+1288 chars]",,fr,'Paris'
