index,url,valid,domain,title,description,image,published,archive,content,quote,language,keyword
https://www.ledauphine.com/coupe-du-monde-de-football/2026/07/02/un-selectionneur-francais-encore-endeuille-debut-de-mutinerie-au-senegal-suivez-la-22e-journee-du-mondial,https://www.ledauphine.com/coupe-du-monde-de-football/2026/07/02/un-selectionneur-francais-encore-endeuille-debut-de-mutinerie-au-senegal-suivez-la-22e-journee-du-mondial,0,www.ledauphine.com,"Coupe du monde 2026. Un sélectionneur français encore endeuillé, Pape Gueye critique le staff sénégalais... Suivez la 22e journée du Mondial","Suite des seizièmes de finale de la Coupe du monde ce jeudi, avec notamment l'affiche Espagne-Autriche (21h). En attendant, la nuit dernière a été riche en émotions, notamment au sein des sélections africaines éliminées, la République démocratique du Congo et…",https://cdn-s-www.ledauphine.com/images/EDB417B3-A52A-4400-90A8-2A1C02A82391/FB1200/photo-1782980666.jpg,2026-07-02T09:15:00Z,,"<li>12:08
Joyeux anniversaire Neil El Aynaoui
Le milieu marocain de l'AS Roma, né à Nancy, fête ce jeudi ses 25 ans. Les Lions de l'Atlas ont rendez-vous en huitièmes de finale avec le Canada, ce s… [+9207 chars]",,fr,'Paris'
https://www.bfmtv.com/international/ce-qui-est-perdu-est-perdu-serge-atlaoui-ex-condamne-a-mort-en-indonesie-raconte-l-enfer-qu-il-a-vecu_AN-202607020466.html,https://www.bfmtv.com/international/ce-qui-est-perdu-est-perdu-serge-atlaoui-ex-condamne-a-mort-en-indonesie-raconte-l-enfer-qu-il-a-vecu_AN-202607020466.html,0,www.bfmtv.com,"""Ce qui est perdu est perdu"": Serge Atlaoui, ex-condamné à mort en Indonésie, raconte ""l'enfer"" qu'il a vécu","Serge Atlaoui a passé près de 20 ans dans les geôles indonésiennes, avant d'être rapatrié en France. Celui qui était condamné à mort raconte comment il a ""tenu"".",https://images.bfmtv.com/7x77o39bKOrCC5MWgo_j58FfCTA=/0x40:768x472/768x0/images/Le-Francais-Serge-Atlaoui-a-sa-sortie-de-la-prison-de-Meaux-Chauconin-le-18-juillet-2025-2113168.jpg,2026-07-02T09:28:29Z,http://web.archive.org/web/20260703020024/https://www.bfmtv.com/international/ce-qui-est-perdu-est-perdu-serge-atlaoui-ex-condamne-a-mort-en-indonesie-raconte-l-enfer-qu-il-a-vecu_AN-202607020466.html,"Serge Atlaoui a passé près de 20 ans dans les geôles indonésiennes, avant d'être rapatrié en France. Celui qui était condamné à mort raconte comment il a ""tenu"".
Il assure vivre ""normalement"", même … [+3867 chars]",,fr,'Indonésie'
https://www.ledauphine.com/faits-divers-justice/2026/07/02/alexis-kohler-poursuivi-pour-prise-illegale-d-interets-une-partie-des-faits-juges-prescrits,https://www.ledauphine.com/faits-divers-justice/2026/07/02/alexis-kohler-poursuivi-pour-prise-illegale-d-interets-une-partie-des-faits-juges-prescrits,0,www.ledauphine.com,Paris. Alexis Kohler poursuivi pour prise illégale d'intérêts : une partie des faits jugés prescrits,L'ancien secrétaire général de l'Elysée était soupçonné de prise illégale d'intérêts dans l’enquête sur ses liens familiaux avec l’armateur MSC.,https://cdn-s-www.ledauphine.com/images/38B2575B-38B1-496C-B2EA-5F8118792565/FB1200/photo-1782987874.jpg,2026-07-02T10:25:00Z,http://web.archive.org/web/20260703020234/https://www.ledauphine.com/faits-divers-justice/2026/07/02/alexis-kohler-poursuivi-pour-prise-illegale-d-interets-une-partie-des-faits-juges-prescrits,"Le Dauphiné Libéré, en tant que responsable de traitement, recueille dans ce formulaire des informations qui sont enregistrées dans un fichier informatisé par son Service Relations Clients, la finali… [+854 chars]",,fr,'Paris'
https://france3-regions.franceinfo.fr/provence-alpes-cote-d-azur/var/toulon/paris-truques-gardes-a-vue-jugement-en-2027-six-questions-sur-l-affaire-qui-secoue-dylan-rocher-et-la-petanque-francaise-3379831.html,https://france3-regions.franceinfo.fr/provence-alpes-cote-d-azur/var/toulon/paris-truques-gardes-a-vue-jugement-en-2027-six-questions-sur-l-affaire-qui-secoue-dylan-rocher-et-la-petanque-francaise-3379831.html,0,france3-regions.franceinfo.fr,"Paris truqués, gardes à vue, jugement en 2027 : quatre questions sur l’affaire qui secoue Dylan Rocher et la pétanque française","À deux jours du Mondial La Marseillaise à pétanque, plusieurs stars du circuit français sont mises en cause dans une enquête pour soupçons de match truqué et de paris sportifs frauduleux. Jugés en 2027, ils contestent les accusations tandis que la justice pou…",https://france3-regions.franceinfo.fr/image/Q9A4-rIGptCG2sjNkX_cToSKztA/930x620/regions/2026/07/02/6a4638909b370595348545.jpg,2026-07-02T10:28:32Z,,"À deux jours du Mondial La Marseillaise à pétanque, plusieurs stars du circuit français sont mises en cause dans une enquête pour soupçons de match truqué et de paris sportifs frauduleux. Jugés en 20… [+7587 chars]",,fr,'Paris'
https://www.franceinfo.fr/culture/reportage-je-suis-fiere-de-lui-a-marseille-bad-bunny-enflamme-le-velodrome-et-confirme-son-statut-d-icone-latino_8089877.html,https://www.franceinfo.fr/culture/reportage-je-suis-fiere-de-lui-a-marseille-bad-bunny-enflamme-le-velodrome-et-confirme-son-statut-d-icone-latino_8089877.html,0,www.franceinfo.fr,"REPORTAGE. ""Je suis fière de lui !"" : à Marseille, Bad Bunny enflamme le Vélodrome et confirme son statut d'icône latino","Show à l'américaine, engagement et célébration de la culture ""reggaeton""... Pour sa première date en France, l'artiste de 32 ans a marqué les spectateurs.",https://www.franceinfo.fr/pictures/abqgz-nfMQDOWYv2rbqTeqFX1EQ/0x288:5532x3400/1500x843/2026/07/02/6a46413fe59ee617410612.jpg,2026-07-02T10:46:21Z,,"Ce n'était pas le Super Bowl, mais Bad Bunny a enflammé la scène du Vélodrome à Marseille. La cité phocéenne a accueilli dans la soirée de mercredi 1er juillet l'une des stars de la musique les plus … [+1982 chars]",,fr,'France'
https://www.lalibre.be/planete/sciences-espace/2026/07/02/nez-barbie-ou-kate-middleton-se-faire-refaire-le-nez-une-tres-vieille-histoire-UBCOPWCN6BB5TIHQSU76W24IQ4/,https://www.lalibre.be/planete/sciences-espace/2026/07/02/nez-barbie-ou-kate-middleton-se-faire-refaire-le-nez-une-tres-vieille-histoire-UBCOPWCN6BB5TIHQSU76W24IQ4/,0,www.lalibre.be,"Nez ""Barbie"" ou ""Kate Middleton"" ? Se faire refaire le nez, une très vieille histoire","Les premiers traitements des déformations nasales remontent à l’Égypte ancienne. Le père de la chirurgie esthétique a pour sa part vécu en Inde, il y a 2 600 ans. Deuxième épisode de notre série : “Ces actes chirurgicaux qui remontent à la nuit des temps”. ...",https://www.lalibre.be/resizer/v2/3AUVD27OY5EWBKT742FVNRXARE.jpg?auth=0a6afe3c71edf2f0d4f4743b8484cbb4e4e32f702f520491de72efedc98dc65f&width=1200&height=630&quality=85&focal=500%2C309,2026-07-02T11:33:58Z,http://web.archive.org/web/20260703064943/https://www.lalibre.be/planete/sciences-espace/2026/07/02/nez-barbie-ou-kate-middleton-se-faire-refaire-le-nez-une-tres-vieille-histoire-UBCOPWCN6BB5TIHQSU76W24IQ4/,"En Ukraine, la chirurgie reconstructrice offre une nouvelle vie aux vétérans : ""Tu as changé à l'extérieur, mais tu es toujours mon papa""Le traité médical décrit 48 blessures, de la fracture du crâne… [+6147 chars]",,fr,'Népal'
https://www.journaldugeek.com/2026/07/02/une-partie-des-transports-en-commun-parisiens-passe-au-prive-ca-change-quoi/,https://www.journaldugeek.com/2026/07/02/une-partie-des-transports-en-commun-parisiens-passe-au-prive-ca-change-quoi/,0,www.journaldugeek.com,"Une partie des transports en commun parisiens passe au privé, ça change quoi ?","Quatre lignes de train, sept de tramway, cinq lots mis sur le marché. L'Île-de-France s'attaque au dernier bastion de la RATP et de la SNCF, mais pour quoi faire ?",https://www.journaldugeek.com/app/uploads/2026/05/metro-automatique-1600x900.jpg,2026-07-02T11:34:45Z,,"Plus de deux millions de voyageurs quotidiens, cinq contrats et un monopole vieux de plusieurs décennies qui commence à se fissurer. Le 2 juillet, le conseil d’administration d’Île-de-France Mobilité… [+2789 chars]",,fr,'France'
https://www.sofoot.com/breves/pronostic-portugal-croatie-analyse-cotes-et-prono-coupe-du-monde,https://www.sofoot.com/breves/pronostic-portugal-croatie-analyse-cotes-et-prono-coupe-du-monde,0,www.sofoot.com,"Pronostic Portugal Croatie : analyse, cotes et prono Coupe du Monde","Pronostic Portugal Croatie : analyse complète, cotes et notre pari Portugal vainqueur pour ce seizième de finale de Coupe du Monde. Découvrez nos conseils.",https://sofoot.s3.eu-central-1.amazonaws.com/wp-content/uploads/2026/07/02111632/derby-1065527-1782983792.png,2026-07-02T14:10:41Z,,"Pronostic Portugal Croatie : analyse complète, cotes et notre pari Portugal vainqueur pour ce seizième de finale de Coupe du Monde. Découvrez nos conseils.
Informations clés
<ul><li>Portugal invain… [+7462 chars]",,fr,'Nigeria'
https://www.courrierinternational.com/article/blog-voyages-nepal-patan-dans-l-ame-newar-4-7_246118,https://www.courrierinternational.com/article/blog-voyages-nepal-patan-dans-l-ame-newar-4-7_246118,0,www.courrierinternational.com,"Népal : Patan, dans l’âme newar (4/7)","Aux portes de Katmandou, Patan concentre tout le raffinement de la civilisation newar : temples de briques rouges, palais sculptés, cours cachées et ateliers où se transmettent encore des savoir-faire séculaires.",https://focus.courrierinternational.com/2026/07/02/85/0/2048/1365/1200/630/60/0/c89b0ba_upload-1-hd843zuutzbh-4-patan-1.JPEG,2026-07-03T08:58:10Z,,"Souvent méconnus, les Newar ont pourtant façonné lun des grands foyers urbains, artistiques et religieux de lHimalaya. Artisans, commerçants et bâtisseurs hors pair, ils ont laissé dans la vallée de … [+4003 chars]",,fr,'Katmandou'
https://www.courrierinternational.com/article/demographie-en-belgique-un-quart-des-femmes-pourrait-n-avoir-jamais-d-enfant_246500,https://www.courrierinternational.com/article/demographie-en-belgique-un-quart-des-femmes-pourrait-n-avoir-jamais-d-enfant_246500,0,www.courrierinternational.com,"En Belgique, un quart des femmes pourrait n’avoir jamais d’enfant","Pour mesurer la baisse de la natalité, une équipe de chercheurs propose un indicateur plus parlant que l’habituel taux de fécondité. Plutôt que de calculer le nombre d’enfants moyen par femme, ils formulent une projection du taux de non-passage à la parentali…",https://focus.courrierinternational.com/2026/07/03/0/0/3081/2054/1200/630/60/0/d43168d_upload-1-j7qqv4tzkmch-043-121495896.jpg,2026-07-03T14:08:45Z,,"Un peu partout dans le monde, à lexception de lAfrique subsaharienne, on est confronté à une inquiétante baisse de la natalité. Un sujet qui devient de plus en plus un enjeu politique, explique le jo… [+1050 chars]",,fr,'Belge'
https://www.courrierinternational.com/article/adaptation-au-kenya-les-agriculteurs-apprennent-a-vivre-en-bons-amis-avec-les-elephants_246546,https://www.courrierinternational.com/article/adaptation-au-kenya-les-agriculteurs-apprennent-a-vivre-en-bons-amis-avec-les-elephants_246546,0,www.courrierinternational.com,"Au Kenya, les agriculteurs apprennent à vivre en bons amis avec les éléphants","Alors que les conflits entre les hommes et les éléphants s’intensifient, au Kenya, une association apprend aux agriculteurs à coexister avec leurs encombrants voisins, raconte le quotidien kényan “Daily Nation”, qui souligne leur utilité pour les écosystèmes …",https://focus.courrierinternational.com/2026/07/03/0/474/5052/3368/1200/630/60/0/efbd7ad_upload-1-rct2uf4bvwcd-058-2615786.jpg,2026-07-03T14:29:42Z,,"Comme beaucoup à la lisière du parc national Tsavo, Henritta fait face à une double menace : le changement climatique et de larges voisins qui peuvent ruiner le travail dune saison en une nuit, résum… [+3464 chars]",,fr,'Kenya'
https://www.20minutes.fr/societe/4232831-20260704-departs-vacances-trafic-charge-noir-autoroutes-jusqu-660-km-bouchons-recenses,https://www.20minutes.fr/societe/4232831-20260704-departs-vacances-trafic-charge-noir-autoroutes-jusqu-660-km-bouchons-recenses,0,www.20minutes.fr,"Départs en vacances : Trafic chargé mais pas noir sur les autoroutes, jusqu’à 660 km de bouchons recensés","Sur les grands axes habituels, le trafic est ralenti par des bouchons épars, notamment sur l’axe Paris-Lyon-Marseille, pour ce premier samedi de départs en vacances",https://img.20mn.fr/tB9pybFiSNCgSSeNixbrUSk/1444x920_bouchon-sur-l-autoroute-a8-suite-a-la-greve-sncf-l-autoroute-est-saturee-antibes-france-10-06-2026-syspeo-sys-d009-credit-syspeo-sipa-2606101735,2026-07-04T11:33:29Z,http://web.archive.org/web/20260704115200/https://www.20minutes.fr/societe/4232831-20260704-departs-vacances-trafic-charge-noir-autoroutes-jusqu-660-km-bouchons-recenses,"Cest un premier samedi de départs en vacances qui roule plutôt bien. Le trafic est chargé mais sans points noirs à la mi-journée sur les autoroutes dans le sens des départs, notamment dans le quart n… [+1338 chars]",,fr,'Alpes'
https://www.presse-citron.net/canicule-a-partir-de-quelle-temperature-peut-on-vraiment-mourir-de-chaud/,https://www.presse-citron.net/canicule-a-partir-de-quelle-temperature-peut-on-vraiment-mourir-de-chaud/,0,www.presse-citron.net,Canicule : à partir de quelle température peut-on vraiment mourir de chaud ?,"Alors qu'une nouvelle canicule frappe le sud de la France, à partir de quelle température peut-elle devenir dangereuse pour la santé.",https://www.presse-citron.net/app/uploads/2022/11/temperature-rechauffement-climatique.jpg,2026-07-04T12:21:06Z,,"Il faudrait habiter dans une grotte (littéralement) pour ne pas sen être rendu compte, la France est touchée depuis quelques semaines par une canicule historique avec des records de chaleur dans de t… [+3160 chars]",,fr,'France'
https://www.ledauphine.com/faits-divers-justice/2026/07/04/onze-voitures-detruites-par-un-incendie-sur-le-parking-d-une-concession,https://www.ledauphine.com/faits-divers-justice/2026/07/04/onze-voitures-detruites-par-un-incendie-sur-le-parking-d-une-concession,0,www.ledauphine.com,Annecy. Onze voitures détruites par un incendie sur le parking d'une concession,"Ce samedi 4 juillet à 21h20, les pompiers sont intervenus avenue du Pont-Neuf à Annecy, pour un feu concernant plusieurs véhicules.",https://cdn-s-www.ledauphine.com/images/992AA4E2-88A2-419A-8833-B19A02EE3ADB/FB1200/photo-1783198462.jpg,2026-07-04T20:50:00Z,http://web.archive.org/web/20260704210926/https://www.ledauphine.com/faits-divers-justice/2026/07/04/onze-voitures-detruites-par-un-incendie-sur-le-parking-d-une-concession,"Le Dauphiné Libéré, en tant que responsable de traitement, recueille dans ce formulaire des informations qui sont enregistrées dans un fichier informatisé par son Service Relations Clients, la finali… [+854 chars]",,fr,'Annecy'
https://france3-regions.franceinfo.fr/auvergne-rhone-alpes/haute-savoie/annecy/onze-vehicules-detruits-dans-un-incendie-sur-le-parking-d-une-concession-a-annecy-3381523.html,https://france3-regions.franceinfo.fr/auvergne-rhone-alpes/haute-savoie/annecy/onze-vehicules-detruits-dans-un-incendie-sur-le-parking-d-une-concession-a-annecy-3381523.html,0,france3-regions.franceinfo.fr,Onze véhicules détruits dans un incendie sur le parking d'une concession à Annecy,"Un important incendie s'est déclaré ce samedi soir sur le parking d'une concession automobile à Annecy. Aucun blessé n’est à déplorer, onze véhicules ont été entièrement détruits par les flammes.",https://france3-regions.franceinfo.fr/image/R1rank_zcnwlvtd6V8kXewtxbfQ/930x620/regions/2026/07/05/6a4a07a9e61e2717040048.jpg,2026-07-05T07:57:11Z,,"Un important incendie s'est déclaré ce samedi soir sur le parking d'une concession automobile à Annecy. Aucun blessé nest à déplorer, onze véhicules ont été entièrement détruits par les flammes.
Ce … [+624 chars]",,fr,'Annecy'
https://www.futura-sciences.com/planete/questions-reponses/meteorologie-mistral-tramontane-sirocco-connaissez-vous-vraiment-vents-soufflent-france-25546/,https://www.futura-sciences.com/planete/questions-reponses/meteorologie-mistral-tramontane-sirocco-connaissez-vous-vraiment-vents-soufflent-france-25546/,0,www.futura-sciences.com,"Mistral, tramontane, sirocco… connaissez-vous vraiment les vents qui soufflent en France ?","Si certains sont très connus, comme le mistral, au sud, d’autres, sur la moitié nord en particulier, soufflent aussi régulièrement mais ne font pas autant la Une de l’actualité. Connaissez-vous tous les vents qui soufflent en France ?",https://cdn8.futura-sciences.com/a1920/images/vent%20manche.jpeg,2026-07-05T10:00:06Z,,"Quatre grands types de vent soufflent en France :
<ul><li>le vent de nord-ouest, en provenance de l'océan atlantique : il apporte fraîcheur et humidité ;</li><li>le vent de nord-est, en provenance d… [+2576 chars]",,fr,'Alpes'
https://france3-regions.franceinfo.fr/provence-alpes-cote-d-azur/bouches-du-rhone/feux-de-foret-plusieurs-massifs-interdits-d-acces-dans-les-bouches-du-rhone-et-le-vaucluse-le-risque-d-incendie-tres-eleve-3381586.html,https://france3-regions.franceinfo.fr/provence-alpes-cote-d-azur/bouches-du-rhone/feux-de-foret-plusieurs-massifs-interdits-d-acces-dans-les-bouches-du-rhone-et-le-vaucluse-le-risque-d-incendie-tres-eleve-3381586.html,0,france3-regions.franceinfo.fr,"Feux de forêt : plusieurs massifs interdits d'accès dans les Bouches-du-Rhône et le Vaucluse, le risque d'incendie ""très élevé""","Selon Météo-France, le risque de départ de feu est très élevé dans les deux départements, à cause des conditions météorologiques. L'accès à plusieurs forêts a été interdit pour réduire les risques.",https://france3-regions.franceinfo.fr/image/Psapm9JxjOopqqtM_zva63hboig/930x620/regions/2026/07/05/6a4a33dc6c6ae220645978.jpg,2026-07-05T11:51:53Z,,"Selon Météo-France, le risque de départ de feu est très élevé dans les deux départements, à cause des conditions météorologiques. L'accès à plusieurs forêts a été interdit pour réduire les risques.
… [+1490 chars]",,fr,'Alpes'
https://www.ledauphine.com/economie/2026/07/05/annecy-eldorado-des-enterrements-de-vie-de-jeune-fille-certains-samedis-on-a-que-des-evjf-de-9-h-a-23-h,https://www.ledauphine.com/economie/2026/07/05/annecy-eldorado-des-enterrements-de-vie-de-jeune-fille-certains-samedis-on-a-que-des-evjf-de-9-h-a-23-h,0,www.ledauphine.com,"Insolite. « Certains samedis, on a que des EVJF de 9 h à 23 h » : pourquoi Annecy est l'eldorado des enterrements de vie de jeune fille",Annecy est une destination très prisée par les témoins pour les enterrements de vie de jeune fille des futures mariées. Un vrai business s’est développé. Mais quels en sont les enjeux ?,https://cdn-s-www.ledauphine.com/images/F79FC936-EE9C-4DF7-BF6B-B89A1733489D/FB1200/photo-1783247050.jpg,2026-07-05T12:36:00Z,,"Quelques semaines avant de se dire “oui” pour le reste de leur vie, les futurs mariés vont retrouver leurs amis respectifs pour un week-end festif avant la grande cérémonie. Annecy est une destinatio… [+433 chars]",,fr,'Annecy'
https://www.ledauphine.com/environnement/2026/07/05/la-vigilance-orange-canicule-s-etend-a-16-departements-lundi-des-incendies-toujours-en-cours,https://www.ledauphine.com/environnement/2026/07/05/la-vigilance-orange-canicule-s-etend-a-16-departements-lundi-des-incendies-toujours-en-cours,0,www.ledauphine.com,"Climat. La vigilance orange canicule s'étend à 16 départements lundi, des incendies toujours en cours","Alors que plusieurs feux de forêts font actuellement rage dans le sud de la France, 16 départements seront en vigilance orange canicule lundi.",https://cdn-s-www.ledauphine.com/images/8EACD03E-0363-456E-ACE8-57CBFADCD579/FB1200/photo-1783261433.jpg,2026-07-05T14:27:00Z,http://web.archive.org/web/20260706054952/https://www.ledauphine.com/environnement/2026/07/05/la-vigilance-orange-canicule-s-etend-a-16-departements-lundi-des-incendies-toujours-en-cours,"Seize départements du sud et de l'ouest de la France passeront en vigilance orange canicule lundi, contre sept dimanche uniquement dans le Sud, a annoncé Météo-France. L'Ardèche, l'Aude, la Drôme, le… [+2878 chars]",,fr,'France'
https://www.lavenir.net/regions/brabantwallon/braine-l-alleud/2026/07/05/la-brainoise-sonia-deteste-marcher-mais-va-se-rendre-a-rome-a-pied-900-km-pour-les-victimes-de-violences-3UAQIQO6SNCNRB7YTVSYCBD3HE/,https://www.lavenir.net/regions/brabantwallon/braine-l-alleud/2026/07/05/la-brainoise-sonia-deteste-marcher-mais-va-se-rendre-a-rome-a-pied-900-km-pour-les-victimes-de-violences-3UAQIQO6SNCNRB7YTVSYCBD3HE/,0,www.lavenir.net,La Brainoise Sonia “déteste marcher”… mais va se rendre à Rome à pied (900 km) pour les victimes de violences,"900 kilomètres, 38 étapes, en pleine chaleur estivale : Sonia, habitante de Braine-l’Alleud âgée de 60 ans, se lance un défi de taille entre le Val d’Aoste et Rome, pour soutenir une cause qui lui tient à cœur. ...",https://www.lavenir.net/resizer/v2/5PB5TKI42FA6FOL7JWNHJMWK3A.jpeg?auth=7e84077d071f84b055e36ad2a7471fae58c0934399ea66ab9a102cbd01fefc6d&width=1200&height=630&quality=85&fitfill=true,2026-07-05T15:42:03Z,http://web.archive.org/web/20260705185114/https://www.lavenir.net/regions/brabantwallon/braine-l-alleud/2026/07/05/la-brainoise-sonia-deteste-marcher-mais-va-se-rendre-a-rome-a-pied-900-km-pour-les-victimes-de-violences-3UAQIQO6SNCNRB7YTVSYCBD3HE/,"Derrière cette initiative, il y a une motivation personnelle forte. Sonia a grandi dans un environnement familial marqué par des violences. ""C'est une cause qui me parle"", résume-t-elle. Pendant long… [+4633 chars]",,fr,'Rome'
https://www.ledauphine.com/faits-divers-justice/2026/07/05/annecy-quatorze-vehicules-brules-en-une-nuit,https://www.ledauphine.com/faits-divers-justice/2026/07/05/annecy-quatorze-vehicules-brules-en-une-nuit,0,www.ledauphine.com,Haute-Savoie. Annecy : quatorze véhicules brûlés en une nuit,"Une hécatombe dans les rues annéciennes ce samedi 4 juillet. En une nuit, 14 véhicules ont été incendiés dans quatre rues différentes : avenue du ...",https://cdn-s-www.ledauphine.com/images/EF11812F-553F-4B65-884D-0E99F66C87DB/FB1200/photo-1783274821.jpg,2026-07-05T18:06:00Z,http://web.archive.org/web/20260705190639/https://www.ledauphine.com/faits-divers-justice/2026/07/05/annecy-quatorze-vehicules-brules-en-une-nuit,"Une hécatombe dans les rues annéciennes ce samedi 4 juillet. En une nuit, 14 véhicules ont été incendiés dans quatre rues différentes : avenue du Pont-Neuf, avenue d’Aléry, rue de Chevennes et rue de… [+1402 chars]",,fr,'Annecy'
https://www.20minutes.fr/sport/4232928-20260705-coupe-monde-2026-annulation-carton-rouge-balogun-cadeau-infantino-trump,https://www.20minutes.fr/sport/4232928-20260705-coupe-monde-2026-annulation-carton-rouge-balogun-cadeau-infantino-trump,0,www.20minutes.fr,Coupe du monde 2026 : L’annulation du carton rouge de Balogun est-elle un « cadeau » d’Infantino à Trump ?,L’attaquant vedette des Etats-Unis pourra finalement jouer le 8e de finale face à la Belgique après un revirement de la FIFA dont les ressorts pourraient avoir un lien avec la Maison-Blanche,https://img.20mn.fr/m1FnqYTfQdaImmvoiWFUiSk/1444x920_gianni-infantino-et-donald-trump-meilleurs-amis-du-monde-dans-le-bureau-ovale-et-au-telephone-pendant-cette-coupe-du-monde,2026-07-05T18:44:02Z,http://web.archive.org/web/20260706014336/https://www.20minutes.fr/sport/4232928-20260705-coupe-monde-2026-annulation-carton-rouge-balogun-cadeau-infantino-trump,Et encore une bien belle trouvaille de Gianni-les-bons-tuyaux. La FIFA a annoncé ce dimanche quelle avait décidé de « gracier » Folarin Balogu en lui retirant le carton rouge infligé en 16e de finale… [+4126 chars],,fr,'Belgique'
https://www.huffingtonpost.fr/sport/article/donald-trump-applaudit-cette-decision-de-la-fifa-qui-stupefie-la-belgique_284066.html,https://www.huffingtonpost.fr/sport/article/donald-trump-applaudit-cette-decision-de-la-fifa-qui-stupefie-la-belgique_284066.html,0,www.huffingtonpost.fr,Donald Trump applaudit cette décision de la Fifa qui « stupéfie » la Belgique,"Avant le 8e de finale du Mondial entre les États-Unis et la Belgique, le carton rouge de l’attaquant américain Folarin Balogun a été suspendu.",https://focus.huffingtonpost.fr/2026/07/05/305/0/6877/3868/1820/1023/75/0/40f3916_upload-1-4agpt0kyclbb-afp-20251205-879q7y2-v1-highres-fblwc2026draw.jpg,2026-07-05T20:08:29Z,,Cest sans doute la décision la plus inattendue prise depuis le début de la Coupe du monde. La Fifa a en effet suspendu ce dimanche 5 juillet le carton rouge infligé à lAméricain Folarin Balogun en 16… [+2944 chars],,fr,'Belge'
