index,url,valid,domain,title,description,image,published,archive,content,quote,language,keyword
https://www.lemonde.fr/international/live/2025/12/01/en-direct-guerre-en-ukraine-donald-trump-estime-que-le-scandale-de-corruption-en-ukraine-n-aide-pas-les-negociations_6655415_3210.html,https://www.lemonde.fr/international/live/2025/12/01/en-direct-guerre-en-ukraine-donald-trump-estime-que-le-scandale-de-corruption-en-ukraine-n-aide-pas-les-negociations_6655415_3210.html,0,www.lemonde.fr,"EN DIRECT, guerre en Ukraine : Donald Trump estime que le scandale de corruption en Ukraine « n’aide pas » les négociations","Le secrétaire d’Etat américain, Marco Rubio, et le chef du Conseil national de sécurité et de défense de l’Ukraine, Rustem Umerov, les discussions entre Américains et Ukrainiens menées dimanche en Floride ont été « productives ». L’émissaire américain Steve W…",https://img.lemde.fr/2025/11/30/301/0/3616/1808/1440/720/60/0/98e4d9f_ftp-import-images-1-mdx7tqqdzf5j-5563101-01-06.jpg,2025-12-01T00:23:20Z,,"Rustem Umerov, chef du Conseil national de sécurité et de défense de lUkraine, a déclaré aux journalistes en Floride quil attendait une réunion « productive » avec la délégation américaine composée d… [+1609 chars]",,fr,'Kiev'
https://www.huffingtonpost.fr/international/article/macron-et-zelensky-se-retrouvent-a-paris-ce-lundi-ce-que-l-on-sait-du-programme-de-la-rencontre_257705.html,https://www.huffingtonpost.fr/international/article/macron-et-zelensky-se-retrouvent-a-paris-ce-lundi-ce-que-l-on-sait-du-programme-de-la-rencontre_257705.html,0,www.huffingtonpost.fr,"Macron et Zelensky se retrouvent à Paris ce lundi, ce que l’on sait du programme de la rencontre",Cette rencontre franco-ukrainienne se déroule dans un contexte de négociations sur un plan américain visant à mettre fin à la guerre en Ukraine.,https://focus.huffingtonpost.fr/2025/11/17/112/0/5338/3002/1820/1023/75/0/6fb2a3c_upload-1-gflqxupl7wvh-afp-20251117-hl-hcampos-2959311-v1-highres-francepoliticsemmanuelmacronvolodymy.jpg,2025-12-01T04:45:09Z,,"« La paix est à portée de main », veut croire le ministre des Affaires étrangères, Jean-Noël Barrot. Avec le même espoir en tête, le président français Emmanuel Macron reçoit ce lundi 1er décembre à … [+2433 chars]",,fr,'Genève'
https://www.franceinfo.fr/sports/sebastien-ogier-dans-l-histoire-du-wrc-lens-nouveau-leader-de-ligue-1-les-biathletes-francais-demarrent-fort-le-recap-sport-du-week-end_7648118.html,https://www.franceinfo.fr/sports/sebastien-ogier-dans-l-histoire-du-wrc-lens-nouveau-leader-de-ligue-1-les-biathletes-francais-demarrent-fort-le-recap-sport-du-week-end_7648118.html,0,www.franceinfo.fr,"Sébastien Ogier dans l'histoire du WRC, Lens nouveau leader de Ligue 1, les biathlètes français démarrent fort... Le récap sport du week-end",Le week-end a également été marqué par le retour d'Antoine Dupont sur la pelouse en Top 14 ainsi que la victoire de Max Verstappen au Qatar qui rebat toutes les cartes à un seule Grand Prix de la fin du championnat de Formule 1.,https://www.franceinfo.fr/pictures/Go7AA037rbmOOGbqIQgciK3d_X8/0x0:1920x1079/1500x843/2025/11/30/design-sans-titre-1-692ca17bd10b6159543754.png,2025-12-01T05:00:01Z,,"Un week-end chargé en émotions fortes. Si les biathlètes français ont parfaitement lancé leur saison olympique, à Ostersund (Suède), Lando Norris devra lui attendre le week-end prochain pour potentie… [+7314 chars]",,fr,'Arabie saoudite'
https://www.courrierinternational.com/article/pendant-que-vous-dormiez-netanyahou-demande-une-grace-presidentielle-honduras-liban-les-informations-de-la-nuit_237944,https://www.courrierinternational.com/article/pendant-que-vous-dormiez-netanyahou-demande-une-grace-presidentielle-honduras-liban-les-informations-de-la-nuit_237944,0,www.courrierinternational.com,"Nétanyahou demande une grâce présidentielle, Honduras, Liban : les informations de la nuit","Israël : Benyamin Nétanyahou demande une grâce présidentielle dans son procès pour corruption. Le Premier ministre israélien a officiellement déposé, dimanche 30 novembre, une demande de grâce auprès du président Isaac Herzog dans le cadre de son procès pour …",https://focus.courrierinternational.com/2025/11/30/0/0/5088/3392/1200/630/60/0/075070a_ftp-import-images-1-3tqhwa8pvikr-2025-11-30t111732z-1870458493-rc2qthab3wev-rtrmadp-3-israel-netanyahu-pardon.JPG,2025-12-01T05:00:02Z,,"Israël : Benyamin Nétanyahou demande une grâce présidentielle dans son procès pour corruption. Le Premier ministre israélien a officiellement déposé, dimanche 30 novembre, une demande de grâce auprès… [+2040 chars]",,fr,'Honduras'
https://www.courrierinternational.com/article/conflit-en-floride-une-reunion-productive-entre-negociateurs-americains-et-ukrainiens-mais-rubio-previent-qu-il-reste-beaucoup-a-faire_237943,https://www.courrierinternational.com/article/conflit-en-floride-une-reunion-productive-entre-negociateurs-americains-et-ukrainiens-mais-rubio-previent-qu-il-reste-beaucoup-a-faire_237943,0,www.courrierinternational.com,"En Floride, une réunion “productive” entre négociateurs américains et ukrainiens, mais Rubio prévient qu’il reste “beaucoup à faire”","Le secrétaire d’État américain, Marco Rubio, estime que les pourparlers avec l’Ukraine sur un accord visant à mettre fin à la guerre entre la Russie et l’Ukraine ont été productifs, mais qu’il reste “encore du travail à faire”.",https://focus.courrierinternational.com/2025/11/30/0/0/3484/2323/1200/630/60/0/9930259_ftp-import-images-1-yfeu7pyedoqj-afp-86m33u7.jpg,2025-12-01T05:01:11Z,,"Les négociateurs américains et ukrainiens ont déclaré, à lissue dune réunion dimanche 30novembre en Floride autour du plan américain visant à mettre fin à la guerre avec la Russie, que celle-ci avait… [+4793 chars]",,fr,'Genève'
https://www.20minutes.fr/monde/ukraine/4188930-20251201-direct-guerre-ukraine-macron-attend-zelensky-elysee,https://www.20minutes.fr/monde/ukraine/4188930-20251201-direct-guerre-ukraine-macron-attend-zelensky-elysee,0,www.20minutes.fr,EN DIRECT Guerre en Ukraine : Macron attend Zelensky à l’Elysée…,Suivez avec nous les informations sur le conflit russo-ukrainien en ce lundi 1er décembre 2025,https://img.20mn.fr/LdzM0LEgTDOwdl9-IGCRkCk/1444x920_french-president-emmanuel-macron-visits-the-27th-mountain-infantry-brigade-in-varces-where-he-meets-young-participants-in-national-engagement-programs-and-the-revamped-defense-and-citizenship-day-before-presiding-over-a-military-ceremony-and-delivering-a-speech-on-national-preparedness-and-youth-involvement-in-the-armed-forces-varces-france-04sipa-1-0179-credit-romain-doucelin-pool-sipa-2511271406,2025-12-01T05:43:54Z,,"Bonjour à toutes et à tous. Comme chaque jour, la rédaction de 20 Minutes est mobilisée pour vous donner lensemble des informations sur le conflit en Ukraine.
Les pourparlers se poursuivent pour met… [+673 chars]",,fr,'Genève'
https://www.les-crises.fr/youtube-a-discretement-supprime-plus-de-700-videos-documentant-les-violations-des-droits-humains-commises-par-israel/,https://www.les-crises.fr/youtube-a-discretement-supprime-plus-de-700-videos-documentant-les-violations-des-droits-humains-commises-par-israel/,0,www.les-crises.fr,YouTube a discrètement supprimé plus de 700 vidéos documentant les violations des droits humains commises par Israël,"Le géant de la tech a supprimé les comptes de trois groupes palestiniens de défense des droits humains de premier plan, capitulant ainsi face aux sanctions de Trump. Source : The Intercept, Nikita Mazurov, Jonah ValdezTraduit par les lecteurs du site Les-Cris…",https://www.les-crises.fr/wp-content/uploads/2025/11/00-12.jpg,2025-12-01T05:55:45Z,,"Le géant de la tech a supprimé les comptes de trois groupes palestiniens de défense des droits humains de premier plan, capitulant ainsi face aux sanctions de Trump.
Source : The Intercept, Nikita M… [+12757 chars]",,fr,'Israël'
https://dailygeekshow.com/?p=997106,https://dailygeekshow.com/?p=997106,0,dailygeekshow.com,Pompéi aquatique : découverte d’une ville médiévale engloutie dans un lac du Kirghizistan,"Au fond d’un lac du nord-est du Kirghizistan, des archéologues ont découvert les vestiges d’une cité médiévale. Ayant constitué un comptoir clé sur la Route de la soie, celle-ci a sombré au XVe siècle, à la suite d’un violent tremblement de terre.
The post Po…",https://dailygeekshow.com/wp-content/uploads/2024/06/une-ruines-englouties.jpg,2025-12-01T07:00:00Z,,"Image d’illustration Vitalis Arnoldus / Shutterstock.com
Au fond dun lac du nord-est du Kirghizistan, des archéologues ont découvert les vestiges dune cité médiévale. Ayant constitué un comptoir clé… [+2648 chars]",,fr,'Arabie saoudite'
https://www.lemonde.fr/international/article/2025/12/01/l-ingerence-de-trump-dans-la-campagne-electorale-au-honduras-revele-ses-contradictions-en-matiere-de-lutte-contre-le-narcotrafic_6655531_3210.html,https://www.lemonde.fr/international/article/2025/12/01/l-ingerence-de-trump-dans-la-campagne-electorale-au-honduras-revele-ses-contradictions-en-matiere-de-lutte-contre-le-narcotrafic_6655531_3210.html,0,www.lemonde.fr,L’ingérence de Trump dans la campagne électorale au Honduras révèle ses contradictions en matière de lutte contre le narcotrafic,"Le président américain a annoncé vouloir gracier l’ex-président hondurien Juan Orlando Hernandez, condamné aux Etats-Unis pour trafic de drogue, alors que des élections générales étaient organisées, dimanche, dans ce pays d’Amérique centrale.",https://img.lemde.fr/2025/11/29/0/0/5500/3666/1440/960/60/0/e6713fc_ftp-import-images-1-c7podlhqrfsa-2025-11-29t180735z-695005190-rc286iacysmz-rtrmadp-3-honduras-election.JPG,2025-12-01T08:47:44Z,,"Une banderole à leffigie de lancien président hondurien Juan Orlando Hernandez, sur laquelle on peut lire « Noublions jamais », et une affiche de la candidate du Parti liberté et refondation, lavocat… [+1567 chars]",,fr,'Honduras'
https://www.huffingtonpost.fr/international/video/en-asie-le-bilan-des-inondations-devastatrices-depasse-les-1-000-morts_257712.html,https://www.huffingtonpost.fr/international/video/en-asie-le-bilan-des-inondations-devastatrices-depasse-les-1-000-morts_257712.html,0,www.huffingtonpost.fr,"En Asie, le bilan des inondations dévastatrices dépasse les 1 000 morts","Des pluies torrentielles se sont abattues ces derniers jours en Asie, touchant l’Indonésie, la Malaisie et la Thaïlande. Le puissant cyclone Ditwah a par ailleurs frappé le Sri Lanka.",https://focus.huffingtonpost.fr/2025/12/01/0/0/7647/4301/1820/1023/75/0/f999c21_upload-1-xaugfuh8ogh2-afp-20251130-86lx8ne-v1-highres-srilankaweatherflood.jpg,2025-12-01T09:48:59Z,,"EN BREFDes inondations dévastatrices en Asie, causées par un cyclone au Sri Lanka et des tempêtes en Thaïlande, Malaisie et Indonésie, ont fait plus de 1000 morts.Les secouristes et militaires sactiv… [+3794 chars]",,fr,'Thaïlande'
https://www.marianne.net/monde/proche-orient/les-jeunes-des-collines-en-cisjordanie-occupee-portrait-d-un-radicalisme-en-expansion,https://www.marianne.net/monde/proche-orient/les-jeunes-des-collines-en-cisjordanie-occupee-portrait-d-un-radicalisme-en-expansion,0,www.marianne.net,"Les ""jeunes des collines"" en Cisjordanie occupée : portrait d'un radicalisme en expansion","En Cisjordanie occupée, les « jeunes des collines », des Israéliens ultranationalistes inspirés par la doctrine sioniste et ultra-religieuse du kahanisme, multiplient les attaques contre les Palestiniens. Leurs actions illégales sont encouragées par les minis…",https://media.marianne.net/assets/as7d3dP92AXDP4f44.jpg?w=1540&h=924&r=fill,2025-12-01T11:00:00Z,,"On les appelle les « jeunes des collines ». Ils ont entre quinze et vingt-cinq ans, portent les cheveux longs et la barbe et arborent de larges kippas. Souvent en rupture familiale et en décrochage s… [+1016 chars]",,fr,'Cisjordanie'
https://www.huffingtonpost.fr/international/article/donald-trump-veut-gracier-l-ex-president-du-honduras-mais-cette-decision-n-a-vraiment-aucun-sens_257722.html,https://www.huffingtonpost.fr/international/article/donald-trump-veut-gracier-l-ex-president-du-honduras-mais-cette-decision-n-a-vraiment-aucun-sens_257722.html,0,www.huffingtonpost.fr,"Donald Trump veut gracier l’ex-président du Honduras, mais cette décision n’a vraiment aucun sens","Le président américain a annoncé qu’il va « accorder une grâce totale et absolue » à Juan Orlando Hernández, condamné à 45 ans de prison aux États-Unis pour narcotrafic.",https://focus.huffingtonpost.fr/2025/08/06/0/0/7269/4088/1820/1023/75/0/1a308d6_upload-1-yceitab9sefn-afp-20250722-2226494987-v4-highres-presidenttrumphostsphillipinespresidentmarco.jpg,2025-12-01T11:29:14Z,,"EN BREFDonald Trump veut gracier Juan Orlando Hernández, ex-président du Honduras, condamné aux États-Unis à 45 ans de prison pour narcotrafic.Cette grâce suscite la stupeur car elle contredit le dis… [+5010 chars]",,fr,'Honduras'
https://www.courrierinternational.com/article/vu-de-guinee-en-guinee-bissau-la-junte-herite-du-pouvoir-comme-d-une-patate-chaude_237967,https://www.courrierinternational.com/article/vu-de-guinee-en-guinee-bissau-la-junte-herite-du-pouvoir-comme-d-une-patate-chaude_237967,0,www.courrierinternational.com,"En Guinée-Bissau, la junte hérite du pouvoir comme d’une “patate chaude”","Alors qu’une délégation de la Communauté économique des États de l’Afrique de l’Ouest est attendue en Guinée-Bissau ce 1er décembre, après un coup d’État aux circonstances encore floues et suspectes, la situation institutionnelle du pays semble toujours aussi…",https://focus.courrierinternational.com/2025/11/26/0/273/3045/2030/1200/630/60/0/f924215_ftp-import-images-1-4bmt8c9dvlrv-2025-11-26t172711z-2022158396-rc2h4iav8hes-rtrmadp-3-bissau-security-army.JPG,2025-12-01T11:29:31Z,,"Manifestement, tous les coups dÉtat ne se ressemblent pas. Autant la chute [du président de Madagascar] Andry Rajoelina, en octobre dernier, avait été saluée par le collectif de la Gen Z, autant, en … [+3971 chars]",,fr,'Cap-Vert'
https://www.courrierinternational.com/article/education-un-afflux-inedit-d-etudiants-non-locaux-transforme-hong-kong-en-ville-universitaire_237252,https://www.courrierinternational.com/article/education-un-afflux-inedit-d-etudiants-non-locaux-transforme-hong-kong-en-ville-universitaire_237252,0,www.courrierinternational.com,Un afflux inédit d’étudiants non locaux transforme Hong Kong en ville universitaire,"Depuis 2021, le nombre d’étudiants venus d’ailleurs a doublé à Hong Kong, surtout grâce à l’arrivée massives de jeunes Chinois du continent. Un phénomène qui dynamise l’économie morose de la ville.",https://focus.courrierinternational.com/2025/11/07/0/0/6000/4000/1200/630/60/0/064b508_upload-1-cjh165bllb2e-hong-kong-4322654.jpg,2025-12-01T12:44:46Z,,"Pour la première fois, cinq universités hongkongaises figurent dans le top 10 du classement Quacquarelli Symonds (QS) des universités asiatiques, se félicite le South China Morning Post. Deuxième bon… [+4479 chars]",,fr,'Kazakhstan'
https://www.acrimed.org/Le-20h-de-Salame-l-info-en-mode-zapping,https://www.acrimed.org/Le-20h-de-Salame-l-info-en-mode-zapping,0,www.acrimed.org,Le 20h de Salamé : l'info en mode zapping,"Analyse.

-
France 2, la rivale de TF1

/ 
France 2, 
Journaux télévisés, 
Léa Salamé",https://www.acrimed.org/IMG/png/20h_salame.png,2025-12-01T13:31:16Z,,"Larrivée de Léa Salamé au 20h de France 2 a été annoncée en grande pompe. Publicité, portraits à sa gloire : impossible de passer à côté. Plusieurs mois après son arrivée, quel bilan tirer de ce chan… [+27215 chars]",,fr,'Cisjordanie'
https://www.courrierinternational.com/article/guerre-coup-de-froid-entre-l-ukraine-et-le-kazakhstan-apres-l-attaque-d-un-terminal-petrolier-en-russie_237972,https://www.courrierinternational.com/article/guerre-coup-de-froid-entre-l-ukraine-et-le-kazakhstan-apres-l-attaque-d-un-terminal-petrolier-en-russie_237972,0,www.courrierinternational.com,Coup de froid entre l’Ukraine et le Kazakhstan après l’attaque d’un terminal pétrolier en Russie,"Après l’attaque par des drones d’un terminal pétrolier situé sur le littoral de la mer Noire et essentiel pour les exportations kazakhes, Astana a protesté contre Kiev, qui a nié viser le Kazakhstan. Des éditorialistes du pays d’Asie centrale s’inquiètent d’u…",https://focus.courrierinternational.com/2025/12/01/0/2/5460/3640/1200/630/60/0/4f751b9_ftp-import-images-1-ueuf2rqfdbrj-2025-12-01t095950z-333464877-rc2dup97ljjp-rtrmadp-3-ukraine-crisis-russia-oil-cpc.JPG,2025-12-01T16:23:46Z,,"Une tension diplomatique inhabituelle est survenue entre Kiev et Astana, deux capitales qui, jusquici, évitaient soigneusement de sopposer sur la scène publique, sur fond de guerre en Ukraine. Le 29 … [+1065 chars]",,fr,'Kazakhstan'
https://www.lemonde.fr/planete/article/2025/12/01/devastee-par-l-ouragan-melissa-la-jamaique-va-recevoir-une-aide-de-6-7-milliards-de-dollars-sur-trois-ans_6655591_3244.html,https://www.lemonde.fr/planete/article/2025/12/01/devastee-par-l-ouragan-melissa-la-jamaique-va-recevoir-une-aide-de-6-7-milliards-de-dollars-sur-trois-ans_6655591_3244.html,0,www.lemonde.fr,"Dévastée par l’ouragan Melissa, la Jamaïque va recevoir une aide de 6,7 milliards de dollars sur trois ans","Les institutions financières internationales, dont le FMI et la Banque mondiale, ont annoncé lundi un plan pour aider l’île des Caraïbes « à mener une reconstruction de long terme qui soit budgétairement soutenable, en combinant fonds d’urgence, financement s…",https://img.lemde.fr/2025/11/21/0/0/2938/1959/1440/960/60/0/f65a79c_ftp-import-images-1-fq6fyougf7aa-bf1395383424443b98a56eed39f740ff-0-96102f80cb1244038b61afdbc33d5dde.jpg,2025-12-01T16:49:13Z,,"Après le passage de louragan Melissa, à Black River (Jamaïque), le 30 octobre 2025. MATIAS DELACROIX/AP
Les institutions financières internationales, dont le Fonds monétaire international (FMI) et l… [+2081 chars]",,fr,'Jamaïque'
https://www.numerama.com/sciences/2132067-baikonour-les-options-pour-la-russie-apres-laccident-du-site-de-lancement-ne-sont-vraiment-pas-fameuses.html,https://www.numerama.com/sciences/2132067-baikonour-les-options-pour-la-russie-apres-laccident-du-site-de-lancement-ne-sont-vraiment-pas-fameuses.html,0,www.numerama.com,Baïkonour : les options pour la Russie après l’accident du site de lancement ne sont vraiment pas fameuses,"L'accident survenu au cosmodrome de Baïkonour apparaît plus grave qu'une avarie industrielle. Il pourrait mettre la Russie dans une vraie impasse stratégique pour un moment. En effet, le pays n'a pas 36 options de repli en matière d'accès autonome à la Statio…","https://c0.lestechnophiles.com/www.numerama.com/wp-content/uploads/2022/03/soyouz-cosmodrome-baikonour.jpg?resize=1600,900&key=831b5e70&watermark",2025-12-01T17:14:02Z,,"L’accident survenu au cosmodrome de Baïkonour apparaît plus grave qu’une avarie industrielle. Il pourrait mettre la Russie dans une vraie impasse stratégique pour un moment. En effet, le pays n’a pas… [+5112 chars]",,fr,'Kazakhstan'
https://www.huffingtonpost.fr/international/article/luigi-mangione-est-de-retour-devant-la-justice-et-pour-le-defendre-ses-avocats-misent-sur-son-sac-a-dos_257728.html,https://www.huffingtonpost.fr/international/article/luigi-mangione-est-de-retour-devant-la-justice-et-pour-le-defendre-ses-avocats-misent-sur-son-sac-a-dos_257728.html,0,www.huffingtonpost.fr,"Luigi Mangione est de retour devant la justice et pour le défendre, ses avocats misent sur… son sac à dos","Le jeune homme de 27 ans est attendu pour une audition préliminaire au tribunal de New York, il est poursuivi pour leur meurtre du PDG d’une compagnie d’assurances santé.",https://focus.huffingtonpost.fr/2024/12/11/372/0/5210/2930/1820/1023/75/0/a02650c_1733902394360-063-2188644936.jpg,2025-12-01T17:16:44Z,,"EN BREFLuigi Mangione est jugé à partir du 1er décembre pour le meurtre de Brian Thompson, PDG de United Healthcare.Les avocats de laccusé contestent lutilisation de preuves trouvées dans son sac à d… [+4426 chars]",,fr,'New York'
https://www.20minutes.fr/monde/niger/4189027-20251201-niger-fin-ere-francaise-uranium-nigerien,https://www.20minutes.fr/monde/niger/4189027-20251201-niger-fin-ere-francaise-uranium-nigerien,0,www.20minutes.fr,Niger : La fin de l’ère française sur l’uranium nigérien,"Depuis 2023, le Niger a mis fin aux exportations d’uranium vers Paris, préférant se tourner vers d’autres partenaires comme la Russie. Un symbole du recul de l’influence française en Afrique",https://img.20mn.fr/f1bE3j02RnCBNpDd_72vASk/1444x920_file-this-undated-file-photo-provided-by-french-nuclear-manufacturer-areva-shows-part-of-the-uranium-mine-of-arlit-in-northern-niger-in-an-oct-3-2012-internal-al-qaida-letter-found-by-the-ap-international-terrorist-moktar-belmoktar-is-excoriated-for-his-unwillingness-to-follow-orders-and-critiqued-for-his-failure-to-carry-out-any-large-attack-his-ego-bruised-he-quit-and-formed-his-own-group-to-compete-directly-with-his-former-employer-within-months-he-he-claimed-responsibility-for-two-attacks-in-algeria-and-niger-so-large-that-they-rivaled-the-biggest-operations-undertaken-by-al-qaida-s-wing-on-the-continent-simultaneous-may-23-attacks-in-northern-niger-on-a-military-base-in-agadez-and-a-french-uranium-mine-in-arlit-killed-35-ap-photo-areva-ho-no-sales-mandatory-credit-areva-mli103-253276029370-undated-file-photo-provided-by-areva-no-sales-mandatory-credit-areva-ap-provides-access-to-this-publicly-distributed-handout-photo-provided-by-areva-for-editorial-purposes-only-1305282001,2025-12-01T17:24:57Z,http://web.archive.org/web/20251201192259/https://www.20minutes.fr/monde/niger/4189027-20251201-niger-fin-ere-francaise-uranium-nigerien,"Année après année, linfluence de la France reflue en Afrique. Si la croissance économique de lAfrique subsaharienne était de 4 % en 2024, le commerce avec la France a, lui, reculé de 0,4 % sur un an,… [+3467 chars]",,fr,'Paris'
https://www.liberation.fr/international/asie-pacifique/peut-etre-que-nous-netions-pas-assez-prepares-lasie-du-sud-est-panse-ses-plaies-apres-des-inondations-devastatrices-20251201_G52FNDMEZFEG3CSDEGHRQJXAMQ/,https://www.liberation.fr/international/asie-pacifique/peut-etre-que-nous-netions-pas-assez-prepares-lasie-du-sud-est-panse-ses-plaies-apres-des-inondations-devastatrices-20251201_G52FNDMEZFEG3CSDEGHRQJXAMQ/,0,www.liberation.fr,«Peut-être que nous n’étions pas assez préparés» : l’Asie du Sud-Est panse ses plaies après des inondations dévastatrices,"On dénombrait ce lundi 1er décembre plus de 1 160 morts au Sri Lanka, en Indonésie, en Thaïlande, au Vietnam et en Malaisie, quasiment le même nombre de disparus et des centaines de milliers de personnes déplacées ou sans abri.",https://www.liberation.fr/resizer/v2/K2ZG35XRQRDI3AH4JLKLYX52OY.jpg?auth=161f9b2654d13d7f57b37ef10c66cbcf836970e225062b54d7363e415c85d9ac&quality=70&width=1200&height=630&focal=2605%2C1039,2025-12-01T18:16:46Z,,«Ces inondations sont un triste rappel: les désastres liés au réchauffement climatique sont en train de devenir la norme et les investissements pour y faire face et les surmonter sont cruciaux.» Lale… [+2519 chars],,fr,'Indonésie'
https://www.lemonde.fr/international/article/2025/12/02/en-haiti-un-magistrat-accuse-d-executer-lui-meme-des-bandits_6655629_3210.html,https://www.lemonde.fr/international/article/2025/12/02/en-haiti-un-magistrat-accuse-d-executer-lui-meme-des-bandits_6655629_3210.html,0,www.lemonde.fr,"En Haïti, un magistrat accusé d’exécuter lui-même des « bandits »","Le Bureau intégré des Nations unies met directement en cause Jean Ernest Muscadin pour la mort de vingt-huit personnes soupçonnées d’appartenir à des gangs, dans le sud du pays. Mais le commissaire du gouvernement compte de nombreux partisans au sein de la po…",https://img.lemde.fr/2025/12/02/0/0/1378/918/1440/960/60/0/0d634b3_upload-1-zt2cgtiwfklv-screen-shot-2025-12-01-at-5-21-21-pm.png,2025-12-02T01:55:03Z,http://web.archive.org/web/20251203152155/https://www.lemonde.fr/international/article/2025/12/02/en-haiti-un-magistrat-accuse-d-executer-lui-meme-des-bandits_6655629_3210.html,"LETTRE DES CARAÏBES
Un portrait du magistrat haïtien Jean Ernest Muscadin extrait de son compte Facebook. 
Homme providentiel ou dangereux hors-la-loi ? En Haïti, les avis sont très tranchés à léga… [+1011 chars]",,fr,'Haïti'
