index,url,valid,domain,title,description,image,published,archive,content,quote,language,keyword
https://www.data.gouv.fr/datasets/cap-sur-les-transitions-1-le-littoral,https://www.data.gouv.fr/datasets/cap-sur-les-transitions-1-le-littoral,0,www.data.gouv.fr,CAP SUR LES TRANSITIONS#1 - Le littoral,"Entre attractivité, biodiversité et adaptation au changement climatique, le littoral de Provence-Alpes-Côte d’Azur concentre des enjeux majeurs. 
Ce premier numéro de la collection *Cap sur les transitions* propose une lecture transversale des dynamiques qui …","https://www.data.gouv.fr/_og/d/c_ObjectPage.takumi,objectTitle_~Q0FQIFNVUiBMRVMgVFJBTlNJVElPTlMjMSAtIExlIGxpdHRvcmFs,orgName_~UsOpZ2lvbiBQcm92ZW5jZS1BbHBlcy1Dw7R0ZS1kJ0F6dXI,orgLogo_~aHR0cHM6Ly91ZGF0YS1hdmF0YXJzLnMzLnJieC5pby5jbG91ZC5vdmgubmV0L2RlL2JhZGQyZDI3NjE0YjY5OTk4OWIyODcwMWM3ZmEzMC0xMDAuanBn,views_0,downloads_0,reuses_0,followers_0,p_Ii9kYXRhc2V0cy9jYXAtc3VyLWxlcy10cmFuc2l0aW9ucy0xLWxlLWxpdHRvcmFsIg.png",2026-07-06T00:00:00Z,,"Entre attractivité, biodiversité et adaptation au changement climatique, le littoral de Provence-Alpes-Côte d’Azur concentre des enjeux majeurs.
Ce premier numéro de la collection Cap sur les transit… [+324 chars]",,fr,'Alpes'
https://france3-regions.franceinfo.fr/auvergne-rhone-alpes/savoie/jo-2030-dans-les-alpes-le-ski-alpinisme-reconduit-le-combine-nordique-sur-la-sellette-le-programme-sportif-officialise-ce-mardi-3380455.html,https://france3-regions.franceinfo.fr/auvergne-rhone-alpes/savoie/jo-2030-dans-les-alpes-le-ski-alpinisme-reconduit-le-combine-nordique-sur-la-sellette-le-programme-sportif-officialise-ce-mardi-3380455.html,0,france3-regions.franceinfo.fr,"JO 2030 dans les Alpes : le ski-alpinisme reconduit, le combiné nordique sur la sellette... Le programme sportif officialisé ce mardi","Le programme sportif des Jeux olympiques d'hiver 2030 prévus dans les Alpes françaises sera établi par le Comité international olympique, mardi 7 juillet. Le CIO décidera notamment des nouvelles épreuves ajoutées au calendrier.",https://france3-regions.franceinfo.fr/image/aV-r2uy-bmHsJEYZHgRlguaILd0/930x620/regions/2026/07/03/6a47799da351d788436484.jpg,2026-07-06T04:05:02Z,,"Le programme sportif des Jeux olympiques d'hiver 2030 prévus dans les Alpes françaises sera établi par le Comité international olympique, mardi 7 juillet. Le CIO décidera notamment des nouvelles épre… [+2116 chars]",,fr,'Alpes'
https://www.20minutes.fr/sport/football/4232935-20260706-coupe-monde-2026-three-lions-heroiques-scandale-balogun-prend-proportions-folles-recap-nuit,https://www.20minutes.fr/sport/football/4232935-20260706-coupe-monde-2026-three-lions-heroiques-scandale-balogun-prend-proportions-folles-recap-nuit,0,www.20minutes.fr,"Coupe du monde 2026 : Des Three Lions héroïques, le scandale Balogun prend des proportions folles… Le récap de la nuit","Comme le football ne s’arrête pas la nuit durant ce Mondial, « 20 Minutes » fait le point ce lundi matin sur tout ce que vous avez manqué. Au menu deux alléchants 8es de finale, Brésil-Norvège et Mexique-Angleterre, plus une polémique XXL côté Fifa",https://img.20mn.fr/25926mvgQleMXfQ9_ClqCCk/1444x920_l-anglais-harry-kane-9-celebre-avec-jude-bellingham-10-apres-avoir-marque-le-troisieme-but-de-son-equipe-sur-penalty-lors-du-match-des-huitiemes-de-finale-de-la-coupe-du-monde-de-football-entre-le-mexique-et-l-angleterre-a-mexico-le-dimanche-5-juillet-2026-ap-photo-eduardo-verdugo-wcth147-26187121889158-2607060528,2026-07-06T05:42:43Z,http://web.archive.org/web/20260706203326/https://www.20minutes.fr/sport/football/4232935-20260706-coupe-monde-2026-three-lions-heroiques-scandale-balogun-prend-proportions-folles-recap-nuit,"La Coupe du monde 2026 attaque déjà son 26e jour de compétition ce lundi, et ses histoires de la nuit sont toujours aussi nombreuses. Cest pourquoi 20 Minutes vous propose, durant tout le tournoi, un… [+8578 chars]",,fr,'Mexique'
https://www.data.gouv.fr/datasets/donnees-essentielles-des-marches-publics-region-auvergne-rhone-alpes-1682,https://www.data.gouv.fr/datasets/donnees-essentielles-des-marches-publics-region-auvergne-rhone-alpes-1682,0,www.data.gouv.fr,Données essentielles des marchés publics - Région Auvergne Rhône-Alpes,"L'arrêté du 14 avril 2017 (https://www.legifrance.gouv.fr/eli/arrete/2017/4/14/ECFM1637256A/jo/texte), modifié par l'arrêté du 27 juillet 2018 (https://www.legifrance.gouv.fr/affichTexte.do?cidTexte=JORFTEXT000037282994&dateTexte=&categorieLien=id), impose à …","https://www.data.gouv.fr/_og/d/c_ObjectPage.takumi,objectTitle_~RG9ubsOpZXMgZXNzZW50aWVsbGVzIGRlcyBtYXJjaMOpcyBwdWJsaWNzIC0gUsOpZ2lvbiBBdXZlcmduZSBSaMO0bmUtQWxwZXM,orgName_~UsOpZ2lvbiBBdXZlcmduZS1SaMO0bmUtQWxwZXM,orgLogo_~aHR0cHM6Ly91ZGF0YS1hdmF0YXJzLnMzLnJieC5pby5jbG91ZC5vdmgubmV0LzZjLzJiZWE0NTU4NjU0ZTEyOGZhZmQ5ZTYyOTkxODE4Zi0xMDAuanBn,views_0,downloads_0,reuses_0,followers_0,p_Ii9kYXRhc2V0cy9kb25uZWVzLWVzc2VudGllbGxlcy1kZXMtbWFyY2hlcy1wdWJsaWNzLXJlZ2lvbi1hdXZlcmduZS1yaG9uZS1hbHBlcy0xNjgyIg.png",2026-07-06T06:16:04Z,,"L'arrêté du 14 avril 2017 (https://www.legifrance.gouv.fr/eli/arrete/2017/4/14/ECFM1637256A/jo/texte), modifié par l'arrêté du 27 juillet 2018 (https://www.legifrance.gouv.fr/affichTexte.do?cidTexte=… [+666 chars]",,fr,'Alpes'
https://france3-regions.franceinfo.fr/auvergne-rhone-alpes/haute-savoie/annecy/les-horaires-de-cinq-lignes-de-bus-prolonges-jusqu-a-1h30-du-matin-pendant-l-ete-a-annecy-3381982.html,https://france3-regions.franceinfo.fr/auvergne-rhone-alpes/haute-savoie/annecy/les-horaires-de-cinq-lignes-de-bus-prolonges-jusqu-a-1h30-du-matin-pendant-l-ete-a-annecy-3381982.html,0,france3-regions.franceinfo.fr,Les horaires de cinq lignes de bus prolongés jusqu'à 1h30 du matin pendant l'été à Annecy,"Les horaires de plusieurs lignes de bus de l'agglomération d'Annecy sont prolongés dans la nuit, à partir de ce jeudi 9 juillet et pour le reste de l'été. Sur cinq lignes, les transports en commun circuleront jusqu'à 1h30 du matin, toutes les semaines, du jeu…",https://france3-regions.franceinfo.fr/image/TrkxB48EWqJ9Y08cCKZuJUbixGY/930x620/regions/2026/07/06/6a4b6c7b47441717438558.jpg,2026-07-06T09:44:55Z,,"Les horaires de plusieurs lignes de bus de l'agglomération d'Annecy sont prolongés dans la nuit, à partir de ce jeudi 9 juillet et pour le reste de l'été. Sur cinq lignes, les transports en commun ci… [+1813 chars]",,fr,'Annecy'
https://www.dhnet.be/sports/cyclisme/tour-de-france/2026/07/06/il-y-a-100-ans-en-1926-un-belge-remporte-letape-la-plus-apocalyptique-de-lhistoire-du-tour-de-france-et-va-gagner-la-grande-boucle-la-plus-longue-EBFYEDOG3BFLJBGVNRGSF6SNXY/,https://www.dhnet.be/sports/cyclisme/tour-de-france/2026/07/06/il-y-a-100-ans-en-1926-un-belge-remporte-letape-la-plus-apocalyptique-de-lhistoire-du-tour-de-france-et-va-gagner-la-grande-boucle-la-plus-longue-EBFYEDOG3BFLJBGVNRGSF6SNXY/,0,www.dhnet.be,"Il y a 100 ans, en 1926, un Belge remporte l’étape la plus apocalyptique de l’histoire du Tour de France, et va gagner la Grande Boucle la plus longue","Lucien Buysse survit à l'enfer le 6 juillet 1926, entre Bayonne et Luchon, et gagne une étape qui est entrée dans la légende du Tour de France. Le Belge triomphe ensuite à Paris après près de 239 heures sur son vélo pour parcourir 5 745 km. ...",https://www.dhnet.be/resizer/v2/ADXZEI4PWJDXLGCVVBGZQE6JNM.jpg?auth=2c8174bf5b759c601965a198ce842006965e4b661b53737b3e9dd28ea2faa69d&width=1200&height=630&quality=85&focal=1500%2C1000,2026-07-06T11:45:26Z,http://web.archive.org/web/20260706204543/https://www.dhnet.be/sports/cyclisme/tour-de-france/2026/07/06/il-y-a-100-ans-en-1926-un-belge-remporte-letape-la-plus-apocalyptique-de-lhistoire-du-tour-de-france-et-va-gagner-la-grande-boucle-la-plus-longue-EBFYEDOG3BFLJBGVNRGSF6SNXY/,"guillement
En 1926, je durcirai tellement les étapes dans les Alpes et les Pyrénées que personne ne réussira à frauder: seulement un vrai champion sera capable de gagner ce Tour!
Henri Desgrange
H… [+5727 chars]",,fr,'Paris'
https://www.franceinfo.fr/environnement/biodiversite/animaux/veritables-nuisibles-pour-les-plantes-deux-scarabees-japonais-captures-dans-les-alpes-maritimes_8096330.html,https://www.franceinfo.fr/environnement/biodiversite/animaux/veritables-nuisibles-pour-les-plantes-deux-scarabees-japonais-captures-dans-les-alpes-maritimes_8096330.html,0,www.franceinfo.fr,"Véritables nuisibles pour les plantes, deux scarabées japonais capturés dans les Alpes-Maritimes","Le ""Popillia japonica"" est un petit scarabée classé comme organisme de quarantaine prioritaire au titre de la réglementation européenne, avec une obligation de surveillance et de lutte, en raison de sa nuisibilité importante.",https://www.franceinfo.fr/pictures/APermEq8-3su8r0lroJ6l2luwe4/0x380:7000x4317/1500x843/2026/07/06/6a4bb689b4016149337311.jpg,2026-07-06T14:07:41Z,,"Deux scarabées japonais (Popillia japonica) - menace pour les plantes - ont été capturés à Cannes (Alpes-Maritimes) le 18 juin, indique lundi 6 juillet la préfecture de la région Provence-Alpes-Côte … [+1661 chars]",,fr,'Alpes'
https://www.huffingtonpost.fr/france/article/40-c-dans-l-aude-les-trois-quarts-du-pays-en-vigilance-orange-mardi-la-3e-canicule-gagne-du-terrain_284495.html,https://www.huffingtonpost.fr/france/article/40-c-dans-l-aude-les-trois-quarts-du-pays-en-vigilance-orange-mardi-la-3e-canicule-gagne-du-terrain_284495.html,0,www.huffingtonpost.fr,"40 °C dans l’Aude, les trois quarts du pays en vigilance orange mardi : la 3e canicule gagne du terrain","Météo-France place 61 départements en vigilance orange canicule pour la journée du mardi 7 juillet, à partir de midi.",https://focus.huffingtonpost.fr/2026/05/24/516/0/5000/2812/1820/1023/75/0/9671594_upload-1-wwhwmwxovffi-afp-20260523-hl-mthomasset-3171424-v1-highres-franceheatwavethermometershowing3.jpg,2026-07-06T14:33:38Z,,"La troisième canicule de lannée gagne du terrain. 61 départements sont placés en vigilance orange par Météo-France pour canicule mardi 7 juillet, à partir de 12 h. 16 départements étaient jusque-là c… [+860 chars]",,fr,'France'
https://france3-regions.franceinfo.fr/auvergne-rhone-alpes/isere/un-nouvel-episode-severe-et-durable-cinq-departements-de-rhone-alpes-passent-en-vigilance-orange-canicule-3382273.html,https://france3-regions.franceinfo.fr/auvergne-rhone-alpes/isere/un-nouvel-episode-severe-et-durable-cinq-departements-de-rhone-alpes-passent-en-vigilance-orange-canicule-3382273.html,0,france3-regions.franceinfo.fr,"""Un nouvel épisode sévère et durable"" : cinq départements de Rhône-Alpes passent en vigilance orange canicule","Les départements de la Savoie, de la Haute-Savoie, de l'Isère, du Rhône et de la Loire sont placés en vigilance orange canicule à partir de ce mardi 7 juillet. Les températures pourraient atteindre jusqu'à 38 °C localement.",https://france3-regions.franceinfo.fr/image/JNuh_rQx4DXM2pO-yck6seAat28/930x620/regions/2026/07/06/6a4bbe4be1032340619467.jpg,2026-07-06T14:46:59Z,,"Les départements de la Savoie, de la Haute-Savoie, de l'Isère, du Rhône et de la Loire sont placés en vigilance orange canicule à partir de ce mardi 7 juillet. Les températures pourraient atteindre j… [+1336 chars]",,fr,'Alpes'
https://france3-regions.franceinfo.fr/auvergne-rhone-alpes/haute-savoie/annecy/c-est-bien-mieux-pas-tellement-justifie-cette-plage-emblematique-d-annecy-redevient-payante-le-cout-de-l-entree-ne-fait-pas-l-unanimite-3382045.html,https://france3-regions.franceinfo.fr/auvergne-rhone-alpes/haute-savoie/annecy/c-est-bien-mieux-pas-tellement-justifie-cette-plage-emblematique-d-annecy-redevient-payante-le-cout-de-l-entree-ne-fait-pas-l-unanimite-3382045.html,0,france3-regions.franceinfo.fr,"""C'est bien mieux"", ""pas tellement justifié"" : cette plage emblématique d'Annecy redevient payante, le coût de l'entrée ne fait pas l'unanimité","L'accès à la plage de l'Impérial, à Annecy, est redevenu payant depuis ce samedi 4 juillet. Une mesure prise par la municipalité pour renforcer la sécurité sur cette plage très populaire. Les premiers avis sont divisés au sein de la population.",https://france3-regions.franceinfo.fr/image/npSb5LjvcUSlxs8FM5Zg1lo0HOw/930x620/regions/2026/07/06/6a4bb0e0d4ca4694652107.jpg,2026-07-06T15:10:01Z,,"L'accès à la plage de l'Impérial, à Annecy, est redevenu payant depuis ce samedi 4 juillet. Une mesure prise par la municipalité pour renforcer la sécurité sur cette plage très populaire. Les premier… [+3221 chars]",,fr,'Annecy'
https://www.ledauphine.com/sport/2026/07/06/des-etoiles-plein-les-yeux-pour-les-haut-savoyards,https://www.ledauphine.com/sport/2026/07/06/des-etoiles-plein-les-yeux-pour-les-haut-savoyards,0,www.ledauphine.com,Sport-boules. « C’est une chose merveilleuse » : comment les Haut-Savoyards de Vieugy et Annecy sont devenus champions de France en doubles,"La formation de l’Espérance Boules de Vieugy, emmenée par Sarah Brémond, ainsi que celle de David Lafiandra d’Annecy ont marqué la compétition de leur empreinte en s’adjugeant le titre national le week-end dernier.",https://cdn-s-www.ledauphine.com/images/4093A033-3195-4192-95C9-5795FBC10C7B/FB1200/photo-1783363056.jpg,2026-07-06T18:45:00Z,,"Le Dauphiné Libéré, en tant que responsable de traitement, recueille dans ce formulaire des informations qui sont enregistrées dans un fichier informatisé par son Service Relations Clients, la finali… [+854 chars]",,fr,'Annecy'
https://www.20minutes.fr/sport/football/4233243-20260707-coupe-monde-2026-lukaku-chambre-trump-gardien-americain-signe-boulette-mondial-recap-nuit,https://www.20minutes.fr/sport/football/4233243-20260707-coupe-monde-2026-lukaku-chambre-trump-gardien-americain-signe-boulette-mondial-recap-nuit,0,www.20minutes.fr,Coupe du monde 2026 : Lukaku chambre Trump et le gardien américain signe LA boulette du Mondial… Le récap de la nuit,"Comme le football ne s’arrête pas la nuit durant ce Mondial, « 20 Minutes » fait le point ce mardi matin sur tout ce que vous avez manqué. Au menu évidemment le « Trump game » Etats-Unis - Belgique en 8e de finale, disputé à 2 heures à Seattle",https://img.20mn.fr/-oxNIGVWRvq6P-jgILldRyk/1444x920_seattle-washington-06-juillet-romelu-lukaku-9-de-belgique-celebre-avec-ses-coequipiers-apres-avoir-marque-le-quatrieme-but-de-l-equipe-lors-du-match-des-8es-de-finale-de-la-coupe-du-monde-de-la-fifa-2026-entre-les-etats-unis-et-la-belgique-au-seattle-stadium-le-6-juillet-2026-a-seattle-washington-jamie-squire-getty-images-afp-photo-de-jamie-squire-getty-images-amerique-du-nord-getty-images-via-afp,2026-07-07T05:48:38Z,,"La Coupe du monde 2026 attaque déjà son 27e jour de compétition ce mardi, et ses histoires de la nuit sont toujours aussi nombreuses. Cest pourquoi 20 Minutes vous propose, durant tout le tournoi, un… [+8803 chars]",,fr,'Belgique'
https://www.ledauphine.com/skichrono/2026/07/07/alpes-2030-le-freeride-et-le-patinage-synchronise-arrivent-le-combine-nordique-disparait,https://www.ledauphine.com/skichrono/2026/07/07/alpes-2030-le-freeride-et-le-patinage-synchronise-arrivent-le-combine-nordique-disparait,0,www.ledauphine.com,"Jeux olympiques d’hiver. Alpes 2030 : le freeride et le patinage synchronisé arrivent, le combiné nordique disparait","Le Comité international olympique (CIO) vient d’officialiser le programme complet pour les JO Alpes 2030 avec notamment la disparition du combiné nordique, une discipline originelle des Jeux d’hiver.",https://cdn-s-www.ledauphine.com/images/0DECD53B-B3E8-419A-8030-8AF4F7D30560/FB1200/photo-1783435301.jpg,2026-07-07T14:41:00Z,,"Cette fois, c’est officiel : le combiné nordique va bel été bien disparaître du programme olympique ! Ce mardi après-midi, la commission exécutive du Comité international olympiquea entériné le progr… [+3003 chars]",,fr,'Alpes'
https://france3-regions.franceinfo.fr/auvergne-rhone-alpes/savoie/jo-2030-dans-les-alpes-le-freeride-et-le-patinage-synchronise-font-leur-entree-au-programme-le-combine-nordique-disparait-3382942.html,https://france3-regions.franceinfo.fr/auvergne-rhone-alpes/savoie/jo-2030-dans-les-alpes-le-freeride-et-le-patinage-synchronise-font-leur-entree-au-programme-le-combine-nordique-disparait-3382942.html,0,france3-regions.franceinfo.fr,"JO 2030 dans les Alpes : le freeride et le patinage synchronisé font leur entrée au programme, le combiné nordique disparaît","Les épreuves de ski et de snowboard freeride, ainsi que le patinage synchronisé, feront leurs grands débuts aux Jeux olympiques dans les Alpes françaises en 2030. En revanche, le combiné nordique ne sera plus au programme.",https://france3-regions.franceinfo.fr/image/54Tp8SKirhCgi_1orfZNH98sqbM/930x620/regions/2026/07/07/6a4d0c4eac83f015362228.jpg,2026-07-07T15:13:17Z,,"Les épreuves de ski et de snowboard freeride, ainsi que le patinage synchronisé, feront leurs grands débuts aux Jeux olympiques dans les Alpes françaises en 2030. En revanche, le combiné nordique ne … [+2134 chars]",,fr,'Alpes'
https://www.ledauphine.com/skichrono/2026/07/07/je-ne-comprends-pas-la-decision-la-colere-de-lena-brocard-apres-la-suppression-du-combine-nordique-des-jeux-olympiques-d-hiver,https://www.ledauphine.com/skichrono/2026/07/07/je-ne-comprends-pas-la-decision-la-colere-de-lena-brocard-apres-la-suppression-du-combine-nordique-des-jeux-olympiques-d-hiver,0,www.ledauphine.com,Alpes 2030. « Je ne comprends pas la décision » : la colère de Léna Brocard après la suppression du combiné nordique des Jeux olympiques d'hiver,"Comme tous les membres de l’équipe de France de combiné nordique, Léna Brocard a été très déçue en apprenant la suppression de sa discipline au programme des JO 2030.",https://cdn-s-www.ledauphine.com/images/7078BC33-7635-4ADF-85ED-8442CEFBA651/FB1200/photo-1783437376.jpg,2026-07-07T15:15:00Z,,"C’est un coup de massue sur tous les athlètes et entraîneurs du combiné nordique dans le monde, en apprenant ce mardi que leur discipline était supprimée du programme olympique pour les Alpes 2030.
… [+1115 chars]",,fr,'Alpes'
https://www.huffingtonpost.fr/sport/article/mondial-apres-avoir-elimine-les-etats-unis-les-joueurs-de-la-belgique-reprennent-la-danse-de-donald-trump_285002.html,https://www.huffingtonpost.fr/sport/article/mondial-apres-avoir-elimine-les-etats-unis-les-joueurs-de-la-belgique-reprennent-la-danse-de-donald-trump_285002.html,0,www.huffingtonpost.fr,"Mondial : après avoir éliminé les États-Unis, les joueurs de la Belgique reprennent la danse de Donald Trump","Après son intervention pour suspendre le carton rouge de Folarin Balogun, le président américain a logiquement eu droit à un clin d’œil appuyé de la part des vainqueurs.",https://focus.huffingtonpost.fr/2026/07/07/0/0/5737/3227/1820/1023/75/0/f9f1e49_upload-1-rnr6k4rixj5t-afp-20260707-2284975196-v1-highres-usavbelgiumroundof16fifaworldcup2026.jpg,2026-07-07T15:18:22Z,,"En demandant expressément la suspension du carton rouge de lattaquant américain Folarin Balogun, une requête acceptée par la Fifa, Donald Trump a sans doute rendu le plus grand service à la sélection… [+3258 chars]",,fr,'Belgique'
https://www.huffingtonpost.fr/sport/article/le-freeride-et-le-patinage-artistique-synchronise-vont-faire-leur-entree-aux-jo-2030-dans-les-alpes_285001.html,https://www.huffingtonpost.fr/sport/article/le-freeride-et-le-patinage-artistique-synchronise-vont-faire-leur-entree-aux-jo-2030-dans-les-alpes_285001.html,0,www.huffingtonpost.fr,Le freeride et le patinage artistique synchronisé vont faire leur entrée aux JO 2030 dans les Alpes,"Le Comité international olympique a communiqué, ce mardi 7 juillet, le programme sportif des Jeux olympiques d’hiver 2030 dans les Alpes.",https://focus.huffingtonpost.fr/2026/07/07/0/0/7648/4302/1820/1023/75/0/073a2ea_upload-1-kxb95rog6ure-afp-20260707-b9hw6g3-v1-highres-filesfinlandolyfra20230fskate.jpg,2026-07-07T16:22:03Z,,"Les Jeux olympiques dhiver 2030 dans les Alpes vont voir lentrée de deux nouvelles disciplines au programme fixe de la compétition. Le Comité international olympique (CIO) a communiqué, ce mardi 7 ju… [+3195 chars]",,fr,'Alpes'
https://www.franceinfo.fr/environnement/evenements-meteorologiques-extremes/vagues-de-chaleur-canicules/la-canicule-gagne-du-terrain-en-france-67-departements-desormais-places-en-vigilance-orange-par-meteo-france_8098253.html,https://www.franceinfo.fr/environnement/evenements-meteorologiques-extremes/vagues-de-chaleur-canicules/la-canicule-gagne-du-terrain-en-france-67-departements-desormais-places-en-vigilance-orange-par-meteo-france_8098253.html,0,www.franceinfo.fr,"La canicule gagne du terrain en France, 67 départements désormais placés en vigilance orange par Météo-France",Le passage en orange d'autres départements est probable lors des prochaines diffusions du bulletin de vigilance de l'institut.,https://www.franceinfo.fr/pictures/PDcwNYmCKyncJ63U1hh6OsvXUQ8/0x0:7378x4150/1500x843/2026/07/07/6a4d2d2d14e93569655516.jpg,2026-07-07T16:48:00Z,,"La vague de chaleur, la deuxième en trois semaines, va encore gagner du terrain vers le nord et l'est. Météo-France a placé 67 départements en vigilance orange canicule mercredi 7 avril, dans son bul… [+1773 chars]",,fr,'Alpes'
https://dailygeekshow.com/?p=1012357,https://dailygeekshow.com/?p=1012357,0,dailygeekshow.com,"Dans les Hautes-Alpes, le dégel du permafrost transforme déjà la vie en haute montagne","Dans les Écrins, le dégel du permafrost ne relève plus d’un futur abstrait. Sentiers déplacés, refuges réinventés, torrents plus brutaux, chapelles menacées : la haute montagne change de visage sous l’effet de la chaleur. Et ce bouleversement silencieux comme…",https://dailygeekshow.com/wp-content/uploads/2026/07/dans-les-hautes-alpes-le-degel-du-permafrost-transforme-deja-la-vie-en-haute-montagne.webp,2026-07-07T17:01:00Z,,"Dans les Écrins, le dégel du permafrost ne relève plus dun futur abstrait. Sentiers déplacés, refuges réinventés, torrents plus brutaux, chapelles menacées : la haute montagne change de visage sous l… [+4833 chars]",,fr,'Alpes'
https://www.huffingtonpost.fr/science/article/cette-etude-pense-savoir-ou-hannibal-et-ses-elephants-ont-traverse-les-alpes_285056.html,https://www.huffingtonpost.fr/science/article/cette-etude-pense-savoir-ou-hannibal-et-ses-elephants-ont-traverse-les-alpes_285056.html,0,www.huffingtonpost.fr,Cette étude pense savoir où Hannibal et ses éléphants ont traversé les Alpes,"Selon cette étude, le col de la Traversette aurait constitué la voie la plus économe en énergie pour les troupes d’Hannibal et de ses 37 éléphants de guerre.",https://focus.huffingtonpost.fr/2026/07/07/393/0/3775/2123/1820/1023/75/0/53c5c05_upload-1-iras3jzua31b-afp-20170213-2881341-v2-highres.jpg,2026-07-07T17:42:05Z,,"Comment Hannibal est-il parvenu à faire franchir les Alpes à larmée carthaginoise et à ses éléphants de guerre pour attaquer Rome ? Une nouvelle étude, parue lundi 6 juillet, et fondée sur des modèle… [+2481 chars]",,fr,'Alpes'
https://www.leprogres.fr/transport/2026/07/07/vers-l-ouverture-d-une-ligne-aerienne-directe-entre-lyon-et-la-chine,https://www.leprogres.fr/transport/2026/07/07/vers-l-ouverture-d-une-ligne-aerienne-directe-entre-lyon-et-la-chine,0,www.leprogres.fr,Rhône. « Amener de l'oxygène » au niveau économique : une ligne aérienne directe entre Lyon et la Chine ?,"Évoquant le bilan à mi-année de la CCI de Lyon Métropole Saint-Etienne Roanne, ce mardi 7 juillet, Philippe Valentin, son président, a indiqué travailler sur un projet de ligne aérienne directe entre Lyon et Shanghai, avec la Région Auvergne Rhône-Alpes.",https://cdn-s-www.ledauphine.com/images/6159AF1C-27C7-4C54-B498-B6300BE162B0/FB1200/photo-1647256728.jpg,2026-07-08T04:30:00Z,,"Va-t-on vers le lancement d'une ligne aérienne directe entre Lyon Saint-Exupéry et la Chine ?
Si rien n'est fait ni acté, la piste semble très sérieuse. Le projet a été évoqué, ce mardi, à Lyon par … [+551 chars]",,fr,'Alpes'
https://www.ledauphine.com/societe/2026/07/08/pourquoi-le-col-agnel-(2744-m)-est-il-si-rare-sur-le-tour-de-france,https://www.ledauphine.com/societe/2026/07/08/pourquoi-le-col-agnel-(2744-m)-est-il-si-rare-sur-le-tour-de-france,0,www.ledauphine.com,Hautes-Alpes. Pourquoi le col Agnel (2744 m) est-il si rare sur le Tour de France ?,C'est le troisième plus haut col de France mais le Tour de France n'y est passé qu'à deux reprises. Découvrez le col Agnel qui culmine à 2744 mètres d'altitude.,https://cdn-s-www.ledauphine.com/images/3C585850-ED5F-4F54-9A2A-7F7C017273E3/FB1200/photo-1687975652.jpg,2026-07-08T10:00:00Z,,"Le col Agnel est un géant des Alpes. Avec un sommet à 2744 mètres d'altitude, il est, derrière la Cime de la Bonette (2802 m) et le col de l'Iseran (2764 m) le troisième col le plus haut de France. P… [+5036 chars]",,fr,'Alpes'
