index,url,valid,domain,title,description,image,published,archive,content,quote,language,keyword
https://www.lemonde.fr/les-decodeurs/article/2025/12/14/municipales-2026-de-la-reforme-paris-lyon-marseille-aux-listes-paritaires-les-nouveautes-du-scrutin_6657248_4355770.html,https://www.lemonde.fr/les-decodeurs/article/2025/12/14/municipales-2026-de-la-reforme-paris-lyon-marseille-aux-listes-paritaires-les-nouveautes-du-scrutin_6657248_4355770.html,0,www.lemonde.fr,"Municipales 2026 : de la réforme Paris-Lyon-Marseille aux listes paritaires, les nouveautés du scrutin","Plusieurs réformes seront inaugurées lors des élections des 15 et 22 mars, dont l’élection directe du conseil municipal à Paris, Lyon et Marseille, ainsi que le scrutin de liste paritaire dans les petites communes.",https://img.lemde.fr/2025/11/10/0/6/5988/3992/1440/960/60/0/068067a_upload-1-fkqjgtuyc6ae-000-1pw817.jpg,2025-12-14T09:00:11Z,,"Un bureau de vote pour lélection municipale, à Lyon, le 15 mars 2020. JEFF PACHOUD / AFP
De Marseille (près de 900 000 habitants) à Freycenet-la-Cuche (une centaine) en Haute-Loire, de grands change… [+8594 chars]",,fr,'Polynésie française'
https://www.jeuneafrique.com/1748983/economie-entreprises/tunis-cotonou-rabat-quelle-ville-offre-le-meilleur-acces-aux-services-de-sante/,https://www.jeuneafrique.com/1748983/economie-entreprises/tunis-cotonou-rabat-quelle-ville-offre-le-meilleur-acces-aux-services-de-sante/,0,www.jeuneafrique.com,"Tunis, Cotonou, Rabat… Quelle ville offre le meilleur accès aux services de santé ?","Alors que l’Afrique de l’Est se distingue, le Maroc est à la peine. C’est l’un des résultats de notre sondage sur la qualité des soins médicaux et l’accessibilité des services de santé réalisé dans le cadre de la dernière édition de notre palmarès sur l’attra…","https://prod.cdn-medias.jeuneafrique.com/cdn-cgi/image/q=auto,f=auto,metadata=none,width=1280,height=720,fit=cover,gravity=0.5000x0.5000/https://prod.cdn-medias.jeuneafrique.com/medias/2024/09/23/jad-20240923-mmo-maroc-politique-sante.jpg",2025-12-14T09:54:01Z,,Mieux vaut tomber malade à Dar es-Salam quà Tanger. Cest lune des conclusions que lon peut tirer des résultats de notre sondage sur laccessibilité et la qualité des services de santé réalisé auprès d… [+2776 chars],,fr,'Maroc'
https://www.journaldugeek.com/2025/12/14/les-batteries-de-tesla-made-in-china-sont-catastrophiques/,https://www.journaldugeek.com/2025/12/14/les-batteries-de-tesla-made-in-china-sont-catastrophiques/,0,www.journaldugeek.com,Les batteries de Tesla « made in China » sont « catastrophiques »,"Tesla n’utilise pas les mêmes batteries partout dans le monde. Et selon un atelier européen spécialisé, ça ne serait pas sans conséquences. Des packs haute tension fournis par LG Energy Solution et fabriqués en Chine montreraient des signes de dégradation net…",https://www.journaldugeek.com/app/uploads/2025/12/Tesla-Model-3-Performance-Highland-bleu-51-1600x900.jpg,2025-12-14T13:02:11Z,,"Tesla a bâti sa réputation sur la maîtrise de la chaîne électrique : moteurs, électronique de puissance et batteries. Pourtant, derrière une apparente homogénéité, le constructeur compose avec plusie… [+3088 chars]",,fr,'Chine'
https://www.huffingtonpost.fr/international/article/cambodge-thailande-malgre-le-cessez-le-feu-de-donald-trump-le-conflit-franchit-un-nouveau-cap_258209.html,https://www.huffingtonpost.fr/international/article/cambodge-thailande-malgre-le-cessez-le-feu-de-donald-trump-le-conflit-franchit-un-nouveau-cap_258209.html,0,www.huffingtonpost.fr,"Cambodge-Thaïlande : malgré le cessez-le-feu de Donald Trump, le conflit franchit un nouveau cap","Ce conflit à la frontière, qui a fait au moins 26 morts depuis le 7 décembre, entrait dans sa deuxième semaine ce dimanche.",https://focus.huffingtonpost.fr/2025/12/14/387/0/4816/2709/1820/1023/75/0/f2334b2_upload-1-nxq2ihq0pxyh-afp-20251214-883a6mu-v2-highres-thailandcambodiaconflict.jpg,2025-12-14T15:00:14Z,,"La Thaïlande et le Cambodge continuaient à se battre ce dimanche 14 décembre à leur frontière. Le conflit, qui a fait au moins 26 morts depuis le 7 décembre, entrait dans sa deuxième semaine après le… [+2717 chars]",,fr,'Thaïlande'
https://www.20minutes.fr/monde/ukraine/4191382-20251214-guerre-ukraine-zelensky-berlin-echanges-diplomatiques-etats-unis,https://www.20minutes.fr/monde/ukraine/4191382-20251214-guerre-ukraine-zelensky-berlin-echanges-diplomatiques-etats-unis,0,www.20minutes.fr,Guerre en Ukraine : Zelensky à Berlin et des échanges diplomatiques avec les Etats-Unis,"« 20 Minutes » fait le point pour vous tous les soirs sur le conflit en Ukraine. Ce dimanche, Volodymyr Zelensky est arrivé en Allemagne, à Berlin, pour rencontrer les émissaires américains Steve Witkoff et Jared Kushner",https://img.20mn.fr/7cuWmZpJQNOWPhwTy0VRVCk/1444x920_mandatory-credit-photo-by-dts-news-agency-germany-handout-bundesregierung-guido-bergmann-shutterstock-16104900a-ukraine-talks-in-berlin-ukrainian-president-volodymyr-zelensky-is-received-by-federal-chancellor-friedrich-merz-cdu-for-talks-at-the-chancellery-handout-bundesregierung-guido-bergmann-ukraine-talks-in-berlin-bundeskanzleramt-germany-14-dec-2025-shutterstock-editorial-ukraine-talks-in-berlin-bundes-16104900a-2512141646,2025-12-14T17:11:53Z,http://web.archive.org/web/20251215225209/https://www.20minutes.fr/monde/ukraine/4191382-20251214-guerre-ukraine-zelensky-berlin-echanges-diplomatiques-etats-unis,EDIT : Cet article a été modifié à 21h04 après lannonce de la fin de la première journée déchanges entre Volodymyr Zelensky et les émissaires américaines. Des discussions qui doivent reprendre lundi.… [+2187 chars],,fr,'Kiev'
https://www.huffingtonpost.fr/international/article/fusillade-a-bondi-beach-netanyahu-a-trouve-le-responsable-et-il-le-cible-sans-menagement_258236.html,https://www.huffingtonpost.fr/international/article/fusillade-a-bondi-beach-netanyahu-a-trouve-le-responsable-et-il-le-cible-sans-menagement_258236.html,0,www.huffingtonpost.fr,Fusillade à Bondi Beach : Netanyahu a trouvé le responsable et il le cible sans ménagement,"Pour Benjamin Netanyahu, la reconnaissance de la Palestine par Anthony Albanese a conduit à cet attentat qui a fait 15 morts. Mais il oublie une partie de l’histoire.",https://focus.huffingtonpost.fr/2025/11/18/98/0/1200/675/1820/1023/75/0/ded6a60_upload-1-zczaixzesq2b-afp-20251016-78zy463-v1-midres-israelpalestinianconflict.jpg,2025-12-15T11:14:19Z,,"La lecture de ce contenu est susceptible dentraîner un dépôt de cookies de la part de lopérateur tiers qui lhéberge. Compte-tenu des choix que vous avez exprimés en matière de dépôt de cookies, nous … [+5505 chars]",,fr,'Palestine'
https://www.liberation.fr/international/asie-pacifique/le-cambodge-accuse-la-thailande-davoir-bombarde-la-province-des-temples-dangkor-20251215_EYYPUNR5O5BXNBK2UCBRGRE2TA/,https://www.liberation.fr/international/asie-pacifique/le-cambodge-accuse-la-thailande-davoir-bombarde-la-province-des-temples-dangkor-20251215_EYYPUNR5O5BXNBK2UCBRGRE2TA/,0,www.liberation.fr,Le Cambodge accuse la Thaïlande d’avoir bombardé la province des temples d’Angkor,Le ministre de l’Information cambodgien affirme ce lundi que la Thaïlande n’avait encore jamais frappé aussi loin à l’intérieur de son territoire. Le nouveau bilan depuis la reprise des combats le 8 décembre entre les deux pays voisins est de 31 morts au tota…,https://www.liberation.fr/resizer/v2/3MBPINPMV5BGZCUPOD5TLCPE7E.jpg?smart=true&auth=0438e5773c9081260dbd0e67e6f076d4a437b9d343871f40c7e474c40edf6bc6&quality=70&width=1200&height=630,2025-12-15T11:53:03Z,,"Après un faux espoir de cessez-le-feu évoqué il y a trois jours par Donald Trump, le Cambodge a accusé ce lundi 15 décembre la Thaïlande davoir bombardé la province de Siem Reap, où se situent les cé… [+2733 chars]",,fr,'Cambodge'
https://www.ledauphine.com/sport/2025/12/15/il-nous-disait-qu-on-etait-grosses-pour-magdeleine-vallieres-du-calvaire-au-titre-mondial,https://www.ledauphine.com/sport/2025/12/15/il-nous-disait-qu-on-etait-grosses-pour-magdeleine-vallieres-du-calvaire-au-titre-mondial,0,www.ledauphine.com,"Cyclisme. « Il nous disait qu'on était grosses » : pour Magdeleine Vallières, du calvaire au titre mondial","Sacrée championne du monde de cyclisme au Rwanda en septembre, la Canadienne Magdeleine Vallières a dévoilé les troubles alimentaires sévères dont elle a souffert ces dernières années.",https://cdn-s-www.ledauphine.com/images/183F1BA9-EE25-47EF-962F-352190FAD5F9/FB1200/photo-1765803077.jpg,2025-12-15T12:52:00Z,,"Son témoignage risque de faire grand bruit dans le peloton féminin, où le poids des coureuses est devenu un sujet sensible et commenté. Magdeleine Vallières, 24 ans, et championne du monde sur route … [+1691 chars]",,fr,'Rwanda'
https://www.courrierinternational.com/article/afrique-les-rebelles-avancent-encore-en-rdc-ou-la-paix-est-plus-que-jamais-en-deroute_238507,https://www.courrierinternational.com/article/afrique-les-rebelles-avancent-encore-en-rdc-ou-la-paix-est-plus-que-jamais-en-deroute_238507,0,www.courrierinternational.com,"Les rebelles avancent encore en RDC, où la paix est plus que jamais en déroute","Malgré la signature, le 4 décembre, à Washington, d’un accord de paix entre le Rwanda et la RDC, les rebelles de l’AFC-M23, soutenus par Kigali, engrangent les conquêtes dans le Sud-Kivu. Après la chute, le 10 décembre, de la ville d’Uvira, le conflit menace …",https://focus.courrierinternational.com/2025/12/14/0/6/6036/4024/1200/630/60/0/353f0c8_ftp-1-ic18hldjgj40-afp-884k2lu.jpg,2025-12-15T13:15:44Z,,"Cest un exode aux dimensions bibliques : 10 000 personnes en deux jours, qui représentent lafflux de réfugiés fuyant les conflits concentrés dans le Sud-Kivu vers le Burundi, entre le 9 et 10 décembr… [+1085 chars]",,fr,'Washington'
https://www.monde-diplomatique.fr/2025/12/PAURON/69063,https://www.monde-diplomatique.fr/2025/12/PAURON/69063,0,www.monde-diplomatique.fr,"Au Rwanda, le pari du sport","Première nation d’Afrique à avoir accueilli les championnats du monde de cyclisme sur route, en septembre 2025, le Rwanda finance aussi des équipes de football de renommée mondiale. Si cette diplomatie sportive en plein essor lui permet de redorer son image, …",https://www.monde-diplomatique.fr/IMG/logo/12_2719_hr.jpg,2025-12-15T16:11:50Z,http://web.archive.org/web/20251127222128/https://www.monde-diplomatique.fr/2025/12/PAURON/69063,"Daniel Onguene. « Le Sport aux sportifs, la politique aux politiciens », 2022 
© Daniel Onguene - OOA Gallery, Barcelone
À quelques jours du début des Mondiaux de cyclisme sur route (21-28 septembr… [+1850 chars]",,fr,'Rwanda'
https://www.lexpress.fr/politique/jerome-guedj-je-considere-avec-effroi-que-lattentat-de-sydney-pourrait-se-produire-chez-nous-5T6C4IKN2ZEAPLVZPFYIAHCNRA/,https://www.lexpress.fr/politique/jerome-guedj-je-considere-avec-effroi-que-lattentat-de-sydney-pourrait-se-produire-chez-nous-5T6C4IKN2ZEAPLVZPFYIAHCNRA/,0,www.lexpress.fr,"Jérôme Guedj : ""Je considère avec effroi que l'attentat de Sydney pourrait se produire chez nous""","Au lendemain du massacre antisémite en Australie, le député socialiste dénonce l’engrenage mortifère qui a conduit au pire.",https://www.lexpress.fr/resizer/v2/TQ2BUF6LZFEPZM3IAZJEK2VOEE.jpg?auth=a04cedbb8b8c36be0b297b5b0ad6307f735097da182cfedf136a278a81b19d95&width=1200&height=630&quality=85&focal=832%2C349,2025-12-15T17:00:00Z,,"Face aux condamnations unanimes de l'attentat antisémite qui a fait 15 morts en Australie, le député PS dénonce une forme dhypocrisie. ""Quand on défile au cri dintifada dans les rues des villes franç… [+7559 chars]",,fr,'Australie'
https://www.numerama.com/tech/2142513-premiere-historique-lukraine-frappe-un-sous-marin-russe-avec-des-drones-sous-la-surface.html,https://www.numerama.com/tech/2142513-premiere-historique-lukraine-frappe-un-sous-marin-russe-avec-des-drones-sous-la-surface.html,0,www.numerama.com,Première historique : l’Ukraine frappe un sous-marin russe avec des drones sous la surface,"La guerre des drones franchit un nouveau cap. Pour la première fois, l'Ukraine a utilisé des drones sous-marins pour frapper un sous-marin russe à quai. L'opération, menée au port de Novorossiïsk, a gravement endommagé un lanceur de missiles Kalibr. L'opérati…","https://c0.lestechnophiles.com/www.numerama.com/wp-content/uploads/2025/12/sous-marin-russe.jpg?resize=1600,900&key=fec37612&watermark",2025-12-15T17:43:22Z,,"La guerre des drones franchit un nouveau cap. Pour la première fois, l’Ukraine a utilisé des drones sous-marins pour frapper un sous-marin russe à quai. L’opération, menée au port de Novorossiïsk, a … [+5759 chars]",,fr,'Ukraine'
https://www.liberation.fr/international/asie-pacifique/conflit-en-asie-du-sud-est-le-cambodge-cherche-a-eviter-une-confrontation-armee-avec-la-thailande-quil-na-aucune-chance-de-gagner-20251215_JOBP6WIEDVH5VLF422EHMGV2SQ/,https://www.liberation.fr/international/asie-pacifique/conflit-en-asie-du-sud-est-le-cambodge-cherche-a-eviter-une-confrontation-armee-avec-la-thailande-quil-na-aucune-chance-de-gagner-20251215_JOBP6WIEDVH5VLF422EHMGV2SQ/,0,www.liberation.fr,Conflit en Asie du Sud-Est : «Le Cambodge cherche à éviter une confrontation armée avec la Thaïlande qu’il n’a aucune chance de gagner»,"Après une semaine d’affrontements qui ont fait au moins 31 morts et déplacé plus de 800 000 personnes, la médiation peine à se concrétiser et constitue une «menace pour la région» comme l’explique la chercheuse invitée à l’Inalco, Astrid Norén-Nilsson.",https://www.liberation.fr/resizer/v2/J3YWT5HJWNGIDLO433H6I2E5AM.jpg?smart=true&auth=ddc1d77c67b05d01e03cbda22e0ca386eb5982b405664e43152008a2173b483f&quality=70&width=1200&height=630,2025-12-15T19:15:31Z,,"Une nouvelle occasion ratée. A la demande de Bangkok, la réunion des ministres des Affaires étrangères de lAsean, qui devait se tenir mardi 16 décembre, a été reportée au lundi 22 décembre. Au vu de … [+689 chars]",,fr,'Thaïlande'
https://www.lemonde.fr/economie/article/2025/12/16/mercosur-au-risque-d-etre-isolee-la-france-change-de-strategie-et-choisit-la-fermete_6658034_3234.html,https://www.lemonde.fr/economie/article/2025/12/16/mercosur-au-risque-d-etre-isolee-la-france-change-de-strategie-et-choisit-la-fermete_6658034_3234.html,0,www.lemonde.fr,"Mercosur : au risque d’être isolée, la France change de stratégie et choisit la fermeté","Malgré les concessions de la Commission, dont la clause de sauvegarde qui devrait être adoptée mardi 16 décembre par le Parlement européen, Matignon appelle à « un report » de l’accord de libre-échange entre l’UE et les pays sud américains.",https://img.lemde.fr/2025/12/15/0/0/6000/4000/1440/960/60/0/a4d39b0_ftp-1-jbep1cajmb0y-2025-12-15t115645z-811713793-rc2obha1m0w2-rtrmadp-3-eu-mercosur-france.JPG,2025-12-16T04:31:26Z,,"Manifestation organisée par des agriculteurs français et la Confédération paysanne pour protester contre laccord de libre-échange UE-Mercosur, à Paris, le 14 octobre 2025. STEPHANE MAHE/REUTERS
Cela… [+1622 chars]",,fr,'Uruguay'
https://www.lesnumeriques.com/forfait-mobile/usa-japon-thailande-les-forfaits-gigsky-les-plus-prises-pour-voyager-pendant-les-fetes-n248192.html,https://www.lesnumeriques.com/forfait-mobile/usa-japon-thailande-les-forfaits-gigsky-les-plus-prises-pour-voyager-pendant-les-fetes-n248192.html,0,www.lesnumeriques.com,"Actualité : USA, Japon, Thaïlande : les forfaits GigSky les plus prisés pour voyager pendant les fêtes","En cette fin d’année 2025, de nombreux voyageurs mettent le cap sur les États-Unis, le Japon ou la Thaïlande pour passer les fêtes. Si vous en faites partie, découvrez les forfaits eSIM GigSky pour rester connecté dans ces destinations et profitez de 10 % de …",https://cdn.lesnumeriques.com/optim/news/24/248192/22375adf-usa-japon-thailande-les-forfaits-gigsky-les-plus-prises-pour-voyager-pendant-les-fetes__1200_678__overflow.jpg,2025-12-16T09:15:00Z,,"Chaque année, les aéroports sont particulièrement fréquentés au mois de décembre. De nombreux voyageurs profitent des vacances dhiver pour fuir le froid et rechercher le soleil, découvrir les marchés… [+3357 chars]",,fr,'Thaïlande'
https://www.lemonde.fr/culture/article/2025/12/16/le-mucem-lache-par-plusieurs-collectivites-territoriales-sur-fond-de-conflit-israelo-palestinien_6658142_3246.html,https://www.lemonde.fr/culture/article/2025/12/16/le-mucem-lache-par-plusieurs-collectivites-territoriales-sur-fond-de-conflit-israelo-palestinien_6658142_3246.html,0,www.lemonde.fr,Le MuCEM lâché par plusieurs collectivités territoriales sur fond de conflit israélo-palestinien,"La région PACA, le département des Bouches-du-Rhône et la Métropole Aix-Marseille-Provence protestent contre la rupture par le musée d’un contrat avec un mécène, Digital Realty, accusé d’avoir des activités liées aux colonies en Cisjordanie. Une prise de posi…",https://img.lemde.fr/2025/12/15/0/0/8256/5504/1440/960/60/0/0ee213b_upload-1-mkg9v5fodjn1-000-77hh8we.jpg,2025-12-16T10:45:14Z,,"Le Musée des civilisations de lEurope et de la Méditerranée (MuCEM) à Marseille, en octobre 2025. MIGUEL MEDINA/AFP
Le 12 décembre, la région PACA, le département des Bouches-du-Rhône et la Métropol… [+1432 chars]",,fr,'Cisjordanie'
https://www.liberation.fr/international/afrique/guerre-en-rdc-sous-pression-americaine-le-m23-annonce-son-retrait-de-la-ville-duvira-20251216_7BRT34K34FCZJFJIR7Y7FJRRVU/,https://www.liberation.fr/international/afrique/guerre-en-rdc-sous-pression-americaine-le-m23-annonce-son-retrait-de-la-ville-duvira-20251216_7BRT34K34FCZJFJIR7Y7FJRRVU/,0,www.liberation.fr,"Guerre en RDC : sous pression américaine, le M23 annonce son retrait de la ville d’Uvira","Six jours après la prise de la ville stratégique, qualifiée par Washington de «claire violation» de l’accord entre la RDC et le Rwanda, le groupe armé soutenu par Kigali a annoncé ce mardi 16 décembre se retirer de ses positions pour donner au processus de pa…",https://www.liberation.fr/resizer/v2/I2SQQWV6QRBLBNT7DZJ3SHBLTM.jpg?auth=92f0023fc685f096525c726a9a70cc26f909b483e6214b2e70c2544ddc002f6f&quality=70&width=1200&height=630&focal=3211%2C1746,2025-12-16T11:07:30Z,,"Moins dune semaine après sêtre emparé dUvira, dans lest de la République démocratique du Congo (RDC), le M23 sapprête déjà à abandonner ses positions. Le groupe armé, soutenu par le Rwanda, la annonc… [+2521 chars]",,fr,'Rwanda'
https://www.20minutes.fr/monde/ukraine/4191850-20251216-guerre-ukraine-russie-rallume-clim-negociations-paix-prix-petrole-chute,https://www.20minutes.fr/monde/ukraine/4191850-20251216-guerre-ukraine-russie-rallume-clim-negociations-paix-prix-petrole-chute,0,www.20minutes.fr,Guerre en Ukraine : La Russie rallume la clim sur les négociations de paix et le prix du pétrole chute,"« 20 Minutes » fait le point pour vous tous les soirs sur le conflit en Ukraine. Ce mardi, le Kremlin a un peu douché l’optimisme général sur l’avancée des négociations de paix",https://img.20mn.fr/U3doghzvSGSUy9x8h-NbISk/1444x920_russian-president-vladimir-putin-listens-to-secretary-of-united-russia-party-s-general-council-vladimir-yakushev-during-their-meeting-at-the-kremlin-in-moscow-on-monday-dec-15-2025-mikhail-metzel-sputnik-kremlin-pool-photo-via-ap-xest102-25349488138429-pool-photo-2512151438,2025-12-16T18:32:03Z,,"Vous avez raté les derniers événements sur la guerre en Ukraine ? 20 Minutes fait le point pour vous tous les soirs. Voici lessentiel de ce mardi 16 décembre, au 1.392e jour du conflit.
Le fait du j… [+2873 chars]",,fr,'Ukraine'
https://www.ledauphine.com/defense-guerre-conflit/2025/12/16/il-a-ouvert-le-feu-directement-un-adolescent-palestinien-tue-par-un-colon-israelien,https://www.ledauphine.com/defense-guerre-conflit/2025/12/16/il-a-ouvert-le-feu-directement-un-adolescent-palestinien-tue-par-un-colon-israelien,0,www.ledauphine.com,Cisjordanie. « Il a ouvert le feu directement » : un adolescent palestinien tué par un colon israélien,"Depuis le début de la guerre à Gaza, les troupes israéliennes et les colons ont tué plus de 1 000 Palestiniens en Cisjordanie, parmi lesquels de nombreux militants, mais aussi des dizaines de civils.",https://cdn-s-www.ledauphine.com/images/C0036007-C5BA-49F6-B782-D99CEE012035/FB1200/photo-1765921378.jpg,2025-12-16T21:43:00Z,,"Un Palestinien âgé de 16 ans a été tué par des tirs de colons israéliens près de Bethléem, en Cisjordanie occupée, a rapporté mardi l'agence de presse palestinienne WAFA. Mouheeb Ahmed Jibril a été a… [+1671 chars]",,fr,'Cisjordanie'
https://www.les-crises.fr/comment-trump-cherche-a-reprimer-la-liberte-d-expression-au-nom-d-israel/,https://www.les-crises.fr/comment-trump-cherche-a-reprimer-la-liberte-d-expression-au-nom-d-israel/,0,www.les-crises.fr,Comment Trump cherche à réprimer la liberté d’expression au nom d’Israël,"L’éradication du terrorisme et de l’antisémitisme est la raison supposée pour laquelle des agents de l’ICE en civil ont arrêté la doctorante Rümeysa Öztürk dans une rue de Somerville, dans le Massachusetts, après qu’elle a coécrit une tribune appelant l’unive…",https://www.les-crises.fr/wp-content/uploads/2025/12/00-2.jpg,2025-12-17T05:55:51Z,,"L’éradication du terrorisme et de l’antisémitisme est la raison supposée pour laquelle des agents de l’ICE en civil ont arrêté la doctorante Rümeysa Öztürk dans une rue de Somerville, dans le Massach… [+17594 chars]",,fr,'Cisjordanie'
https://www.jeuneafrique.com/1750229/politique/niger-mali-burkina-faso-donald-trump-impose-des-restrictions-dentree-a-sept-nouveaux-pays-ainsi-quaux-palestiniens/,https://www.jeuneafrique.com/1750229/politique/niger-mali-burkina-faso-donald-trump-impose-des-restrictions-dentree-a-sept-nouveaux-pays-ainsi-quaux-palestiniens/,0,www.jeuneafrique.com,"Niger, Mali, Burkina Faso… Donald Trump impose des restrictions d’entrée à sept nouveaux pays, ainsi qu’aux Palestiniens",« Menace » et « nuisance » sont les deux arguments avancés par le président américain pour justifier cette nouvelle mesure visant à « protéger la sécurité des États-Unis. »,"https://prod.cdn-medias.jeuneafrique.com/cdn-cgi/image/q=auto,f=auto,metadata=none,width=1280,height=720,fit=cover,gravity=0.5352x0.2243/https://prod.cdn-medias.jeuneafrique.com/medias/2025/11/05/jad20251105-ass-nigeria-us-trump-menaces.jpg",2025-12-17T09:20:38Z,,"Ce 17 décembre, les interdictions dentrée aux États-Unis viennent dêtre étendues aux ressortissants de sept pays, dont la Syrie, ainsi quaux Palestiniens, sur décision du président Trump. Le présiden… [+2882 chars]",,fr,'Mali'
https://www.lalibre.be/international/asie/2025/12/17/derriere-le-conflit-entre-la-thailande-et-le-cambodge-lemprise-croissante-de-la-cybercriminalite-en-asie-du-sud-est-VSDC7JBALVBL3NY6NZXQMV6DGY/,https://www.lalibre.be/international/asie/2025/12/17/derriere-le-conflit-entre-la-thailande-et-le-cambodge-lemprise-croissante-de-la-cybercriminalite-en-asie-du-sud-est-VSDC7JBALVBL3NY6NZXQMV6DGY/,0,www.lalibre.be,"Derrière le conflit entre la Thaïlande et le Cambodge, l’emprise croissante de la cybercriminalité en Asie du Sud-Est",Le vieux contentieux frontalier entre les deux pays se greffe sur la lutte contre les influents réseaux d’escroqueries en ligne. ...,https://www.lalibre.be/resizer/v2/3MKQBQNJAVA3TNZ5BWHPWU67DU.jpg?auth=7a739068bd99be6f5bf63ca14e58d5f91fe93d3de97deae80e2441ccaaa58df8&width=1200&height=630&quality=85&focal=2970%2C1980,2025-12-17T10:42:53Z,,"Depuis le 7 décembre, les hostilités ont en effet repris entre la Thaïlande et le Cambodge, chacun s'en rejetant la responsabilité. La principale cause du litige est le contrôle de territoires contes… [+7429 chars]",,fr,'Birmanie'
https://www.lemonde.fr/economie/article/2025/12/17/mercosur-l-italie-et-la-france-menacent-de-bloquer-l-accord-de-libre-echange-lula-lance-un-ultimatum-aux-europeens_6658433_3234.html,https://www.lemonde.fr/economie/article/2025/12/17/mercosur-l-italie-et-la-france-menacent-de-bloquer-l-accord-de-libre-echange-lula-lance-un-ultimatum-aux-europeens_6658433_3234.html,0,www.lemonde.fr,"Mercosur : l’Italie et la France menacent de bloquer l’accord de libre-échange, Lula lance un ultimatum aux Européens","La présidente du conseil italien, Giorgia Meloni, est plus que jamais en position de déclencher ou pas la signature imminente du traité UE-Mercosur. Si la France refuse, la Commission, l’Allemagne et l’Espagne poussent à un accord et le Brésil fait monter la …",https://img.lemde.fr/2025/12/17/0/0/3657/2438/1440/960/60/0/c659921_ftp-1-0apexk0bpw7p-2025-12-17t143005z-435551359-rc2diia7k1ac-rtrmadp-3-italy-politics.JPG,2025-12-17T19:43:21Z,,"La présidente du conseil italien, Giorgia Meloni, sexprime devant la Chambre basse du Parlement, avant le sommet des dirigeants de lUnion européenne, à Rome, le 17 décembre 2025. REMO CASILLI / REUTE… [+1413 chars]",,fr,'Uruguay'
