index,url,valid,domain,title,description,image,published,archive,content,quote,language,keyword
https://www.franceinfo.fr/sports/rugby/coupe-du-monde/coupe-du-monde-de-rugby-2027-bien-lotie-la-france-affrontera-le-japon-les-etats-unis-et-les-samoa-la-nouvelle-zelande-dans-le-groupe-de-l-australie_7655471.html,https://www.franceinfo.fr/sports/rugby/coupe-du-monde/coupe-du-monde-de-rugby-2027-bien-lotie-la-france-affrontera-le-japon-les-etats-unis-et-les-samoa-la-nouvelle-zelande-dans-le-groupe-de-l-australie_7655471.html,0,www.franceinfo.fr,"Coupe du monde de rugby 2027 : bien lotie, la France affrontera le Japon, les Etats-Unis et les Samoa, la Nouvelle-Zélande dans le groupe de l'Australie","Le tirage au sort de la Coupe du monde 2027, qui se disputera en Australie (du 1er octobre au 13 novembre), s'est déroulé, mercredi, à Sydney (Australie).",https://www.franceinfo.fr/pictures/XX-alsNgDOKpjrXP4YX-Yp-poOM/0x213:4096x2517/1500x843/2025/12/03/075-cippitelli-italyvwa250223-np7kk-692ff9b38953c380373263.jpg,2025-12-03T09:37:00Z,,"Le XV de France aurait pu tomber sur l'Australie ou l'Ecosse. Mais le tirage au sort de la Coupe du monde 2027, qui a eu lieu mercredi 3 décembre depuis Sydney (Australie), a placé les hommes de Fabi… [+709 chars]",,fr,'Japon'
https://www.lemonde.fr/sport/article/2025/12/03/coupe-du-monde-de-rugby-2027-l-equipe-de-france-de-rugby-opposee-au-japon-aux-etats-unis-et-aux-samoa-apres-le-tirage-au-sort_6655825_3242.html,https://www.lemonde.fr/sport/article/2025/12/03/coupe-du-monde-de-rugby-2027-l-equipe-de-france-de-rugby-opposee-au-japon-aux-etats-unis-et-aux-samoa-apres-le-tirage-au-sort_6655825_3242.html,0,www.lemonde.fr,"Coupe du monde de rugby 2027 : l’équipe de France de rugby opposée au Japon, aux Etats-Unis et aux Samoa, après le tirage au sort","Le tirage au sort du prochain tournoi mondial, qui se disputera en Australie à l’automne 2027, s’est déroulé mercredi. Le XV de France d’Antoine Dupont est tombé dans un groupe E qui semble à sa portée.",https://img.lemde.fr/2025/11/22/0/30/3939/2626/1440/960/60/0/c6bd5d4_ftp-import-images-1-dpijp6myvcpq-2025-11-22t215200z-1090621757-up1elbm1oqn2j-rtrmadp-3-rugby-union-fra-aus.JPG,2025-12-03T09:42:45Z,,"Léquipe de France masculine de rugby à la fin de leur match de la tournée dautomne face à lAustralie, le 22 novembre 2025 à Saint-Denis (Seine-Saint-Denis). GONZALO FUENTES/REUTERS
Si loin, mais déj… [+3814 chars]",,fr,'Australie'
https://www.bfmtv.com/international/asie/la-colere-monte-en-indonesie-le-bilan-des-inondations-records-depasse-les-800-morts_AD-202512030425.html,https://www.bfmtv.com/international/asie/la-colere-monte-en-indonesie-le-bilan-des-inondations-records-depasse-les-800-morts_AD-202512030425.html,0,www.bfmtv.com,"La colère monte en Indonésie, le bilan des inondations records dépasse les 800 morts","Plus de 1.300 personnes sont mortes lors des violentes inondations survenues à la fin du mois de novembre en Asie du Sud-Est. À l'inverse de l'Indonésie, le Sri Lanka a déclaré l'état d'urgence et appelé la communauté internationale à l'aide.",https://images.bfmtv.com/8l7ECEHd4D_PJiFqob44vds48_s=/0x63:1200x738/1200x0/images/Inondations-Indonesie-et-Sri-Lanka-2194170.jpg,2025-12-03T09:49:40Z,,"Plus de 1.300 personnes sont mortes lors des violentes inondations survenues à la fin du mois de novembre en Asie du Sud-Est. À l'inverse de l'Indonésie, le Sri Lanka a déclaré l'état d'urgence et ap… [+4240 chars]",,fr,'Birmanie'
https://www.courrierinternational.com/article/politique-en-haiti-le-pessimisme-regne-vis-a-vis-des-elections-annoncees-pour-aout_238087,https://www.courrierinternational.com/article/politique-en-haiti-le-pessimisme-regne-vis-a-vis-des-elections-annoncees-pour-aout_238087,0,www.courrierinternational.com,"En Haïti, le pessimisme règne vis-à-vis des élections annoncées pour août","Mardi 2 décembre, les autorités haïtiennes de transition ont annoncé l’organisation d’élections législatives et présidentielle en août 2026, les premières depuis neuf ans. Dans le pays le plus pauvre d’Amérique, largement contrôlé par les gangs et dévasté par…",https://focus.courrierinternational.com/2025/11/26/0/0/5500/3666/1200/630/60/0/b48480b_ftp-import-images-1-vygm3mhb2p4g-2025-11-26t153023z-944197371-rc2ikhaj9n34-rtrmadp-3-usa-trump-migration-haiti.JPG,2025-12-03T13:12:10Z,,"Dans les jours qui viennent, pressés par les États-Unis dAmérique et coincés après leur tentative ratée de se défaire du Premier ministre Alix Didier Fils-Aimé, les membres du Conseil présidentiel de… [+1073 chars]",,fr,'Haïti'
https://www.globenewswire.com/news-release/2025/12/03/3199165/0/fr/ASSYSTEM-Informations-relatives-au-nombre-total-de-droits-de-vote-et-d-actions-composant-le-capital-social-au-30-novembre-2025.html,https://www.globenewswire.com/news-release/2025/12/03/3199165/0/fr/ASSYSTEM-Informations-relatives-au-nombre-total-de-droits-de-vote-et-d-actions-composant-le-capital-social-au-30-novembre-2025.html,0,www.globenewswire.com,ASSYSTEM : Informations relatives au nombre total de droits de vote et d'actions composant le capital social au 30 novembre 2025,"Informations relatives au nombre d’actions composant le capital social et au nombre total de droits de vote correspondants  Paris La Défense, le 3...",https://ml-eu.globenewswire.com/Resource/Download/71962db3-49a0-48a8-b994-d12853134c03,2025-12-03T16:35:00Z,,"Informations relatives au nombre dactions composant le capital social et au nombre total de droits de vote correspondants
Paris La Défense, le 3 décembre 2025 Assystem S.A. (ISIN : FR0000074148 - AS… [+2045 chars]",,fr,'Cap-Vert'
https://www.20minutes.fr/monde/ukraine/4189499-20251203-guerre-ukraine-moscou-montre-muscles-europe-scepticisme-negociations-patinent,https://www.20minutes.fr/monde/ukraine/4189499-20251203-guerre-ukraine-moscou-montre-muscles-europe-scepticisme-negociations-patinent,0,www.20minutes.fr,"Guerre en Ukraine : Moscou montre ses muscles, l’Europe son scepticisme et les négociations patinent","« 20 Minutes » fait le point pour vous tous les soirs sur le conflit en Ukraine. Ce mercredi, force est de constater que la rencontre entre Poutine et les émissaires de Donald Trump n’a pas donné grand-chose",https://img.20mn.fr/ugtsgbJISz6jTY8yL9vrayk/1444x920_vladimir-poutine-a-fait-savoir-ce-mercredi-que-les-succes-de-l-armee-russe-sur-le-terrain-pesaient-forcement-sur-les-negociations-de-paix,2025-12-03T18:42:21Z,http://web.archive.org/web/20251203191023/https://www.20minutes.fr/monde/ukraine/4189499-20251203-guerre-ukraine-moscou-montre-muscles-europe-scepticisme-negociations-patinent,"Vous avez raté les derniers événements sur la guerre en Ukraine ? 20 Minutes fait le point pour vous tous les soirs. Voici lessentiel de ce mercredi 3 décembre, au 1.378e jour du conflit.
Le fait du… [+2542 chars]",,fr,'Kiev'
https://www.opinion-internationale.com/2025/12/04/manisha-gunasekera-ambassadrice-du-sri-lanka-en-france-malgre-lintensite-du-cyclone-ditwah-mais-avec-laide-de-la-communaute-internationale-nous-nous-releverons_139915.html,https://www.opinion-internationale.com/2025/12/04/manisha-gunasekera-ambassadrice-du-sri-lanka-en-france-malgre-lintensite-du-cyclone-ditwah-mais-avec-laide-de-la-communaute-internationale-nous-nous-releverons_139915.html,0,www.opinion-internationale.com,"Manisha Gunasekera, ambassadrice du Sri Lanka en France : « malgré l’intensité du cyclone Ditwah mais avec l’aide de la communauté internationale, nous nous relèverons ! »","Après le passage dévastateur du cyclone Ditwah, qui a frappé le Sri Lanka avec une violence inédite et laissé derrière lui des centaines de morts et des milliers de sinistrés, l’Ambassadrice…
L’article Manisha Gunasekera, ambassadrice du Sri Lanka en France :…",https://www.opinion-internationale.com/wp-content/uploads/2025/12/Manisha-Gunasekera-ambassadrice-du-Sri-Lanka-en-France-22malgre-lintensite-du-cyclone-Ditwah-et-avec-laide-de-la-communaute-internationale-nous-nous-releverons-22-4.jpg,2025-12-04T00:07:34Z,,"Après le passage dévastateur du cyclone Ditwah, qui a frappé le Sri Lanka avec une violence inédite et laissé derrière lui des centaines de morts et des milliers de sinistrés, lAmbassadrice du Sri La… [+7224 chars]",,fr,'France'
https://www.lemonde.fr/international/article/2025/12/04/delyan-peevski-le-puissant-oligarque-qui-met-les-bulgares-dans-la-rue_6655914_3210.html,https://www.lemonde.fr/international/article/2025/12/04/delyan-peevski-le-puissant-oligarque-qui-met-les-bulgares-dans-la-rue_6655914_3210.html,0,www.lemonde.fr,"Delyan Peevski, le puissant oligarque qui met les Bulgares dans la rue","Visé par des sanctions américaines, ce chef d’un petit parti représentant les minorités turque et rom est accusé de tirer les ficelles du pouvoir dans un pays miné par la corruption. Alors que la Bulgarie doit rejoindre la zone euro le 1ᵉʳ janvier 2026, l’opp…",https://img.lemde.fr/2025/12/03/0/0/8256/5504/1440/960/60/0/f41cbc4_upload-1-fzyynuibpzfy-215970.jpg,2025-12-04T03:00:05Z,,"Un rassemblement contre les mesures daustérité prévues dans le projet de budget pour lannée 2026, à Sofia, le 1 décembre 2025. VALENTINA PETROVA/AP
« Quand Peevski tombera/Je ne voudrai pas être au-… [+1253 chars]",,fr,'Sofia'
https://www.courrierinternational.com/article/ukraine-bruxelles-privilegie-l-utilisation-des-avoirs-russes-pour-aider-kiev-au-grand-dam-de-la-belgique_238108,https://www.courrierinternational.com/article/ukraine-bruxelles-privilegie-l-utilisation-des-avoirs-russes-pour-aider-kiev-au-grand-dam-de-la-belgique_238108,0,www.courrierinternational.com,"Bruxelles privilégie l’utilisation des avoirs russes pour aider Kiev, au grand dam de la Belgique","La Commission européenne a présenté mercredi deux options pour fournir 90 milliards d’euros à l’Ukraine sur les deux prochaines années : emprunter sur les marchés internationaux ou utiliser les avoirs russes gelés, une solution qu’elle juge préférable. Cette …",https://focus.courrierinternational.com/2025/12/03/0/0/3120/2080/1200/630/60/0/36f7af8_ftp-1-05fkmnk7k6g2-2025-12-03t124436z-1081741668-rc209ia5xj7g-rtrmadp-3-ukraine-crisis-eu.JPG,2025-12-04T05:03:16Z,,"Alors que les caisses de Kiev se vident à vue dil, la Commission européenne a présenté mercredi 3 décembre un plan pour soutenir lUkraine pour les deux ans à venir et la mettre dans une position de f… [+3096 chars]",,fr,'Bruxelles'
https://www.franceinfo.fr/coupe-du-monde/48-equipes-56-jours-de-competition-des-supporters-prives-d-entree-on-vous-explique-en-quoi-la-coupe-du-monde-2026-s-annonce-atypique_7653389.html,https://www.franceinfo.fr/coupe-du-monde/48-equipes-56-jours-de-competition-des-supporters-prives-d-entree-on-vous-explique-en-quoi-la-coupe-du-monde-2026-s-annonce-atypique_7653389.html,0,www.franceinfo.fr,"48 équipes, 56 jours de compétition, des supporters privés d'entrée... On vous explique en quoi la Coupe du monde 2026 s'annonce atypique","Le tirage au sort du Mondial à 48 équipes a lieu, vendredi, à Washington, à un peu plus de six mois du lancement de l'édition 2026.",https://www.franceinfo.fr/pictures/mvkYHNOZIf2HAMBoCC-Ufa-xhTY/0x155:7034x4109/1500x843/2025/12/02/000-84lm27v-692ec9853cb67750714339.jpg,2025-12-04T05:10:02Z,,"L'échéance se rapproche. A un peu plus de six mois du début de la Coupe du monde, le 11 juin prochain (jusqu'au 19 juillet), le tirage au sort de la phase de groupes a lieu, vendredi 5 décembre, à 18… [+6574 chars]",,fr,'Cap-Vert'
https://www.20minutes.fr/monde/ukraine/4189581-20251204-direct-guerre-ukraine-macron-insiste-aupres-xi-importance-chine-mettre-fin-conflit,https://www.20minutes.fr/monde/ukraine/4189581-20251204-direct-guerre-ukraine-macron-insiste-aupres-xi-importance-chine-mettre-fin-conflit,0,www.20minutes.fr,EN DIRECT Guerre en Ukraine : Macron insiste auprès de Xi sur l’importance de la Chine pour mettre fin au conflit…,Suivez avec nous les informations sur le conflit russo-ukrainien en ce jeudi 4 décembre 2025,https://img.20mn.fr/K5hxKosITnOGm3Jup_zjZCk/1444x920_official-welcoming-ceremony-handshake-between-the-french-president-of-the-republic-emmanuel-macron-and-by-china-s-president-xi-jinping-great-hall-of-the-people-grand-palais-du-peuple-beijing-china-thursday-4-december-2025-the-french-president-of-the-republic-and-his-wife-french-first-lady-visit-the-popular-republic-of-china-on-a-state-visit-from-3-to-5-december-2025-01accorsinijeanne-welcome-0028-credit-jeanne-accorsini-sipa-2512040441,2025-12-04T05:31:27Z,,"Avant la déclaration de Donald Trump mercredi, le conseiller diplomatique du président russe, Iouri Ouchakov, avait estimé que les récents « succès » de larmée russe avaient « influencé le déroulemen… [+542 chars]",,fr,'Kiev'
https://www.20minutes.fr/monde/chine/4189481-20251204-guerre-ukraine-comment-pekin-soutient-moscou-malgre-neutralite-affichee,https://www.20minutes.fr/monde/chine/4189481-20251204-guerre-ukraine-comment-pekin-soutient-moscou-malgre-neutralite-affichee,0,www.20minutes.fr,Guerre en Ukraine : Comment Pékin soutient Moscou malgré sa neutralité affichée,"Emmanuel Macron est arrivé mercredi en Chine pour deux jours. La guerre en Ukraine est au programme des échanges. Malgré sa neutralité affichée, Pékin continue ses échanges commerciaux avec la Russie",https://img.20mn.fr/wF9WDP7ITn6N0NMMDECpgyk/1444x920_chinese-president-xi-jinping-toasts-during-the-gala-dinner-offered-to-spain-s-king-felipe-vi-and-queen-letizia-at-the-great-hall-of-people-in-beijing-china-12-november-2025-spain-s-royal-couple-is-on-a-state-visit-to-china-until-13-november-efe-chema-moya-efe-20251112-8b78c646b05fe35d4914ab7b3becb5a837840279-credit-chema-moya-efe-sipa-2511121427,2025-12-04T06:02:36Z,,Emmanuel Macron est arrivé ce mercredi en Chine pour une visite dEtat qui doit durer deux jours. Au menu des discussions avec son homologue Xi Jinping : la guerre en Ukraine. Le président français de… [+3859 chars],,fr,'Chine'
https://www.20minutes.fr/societe/4189591-20251204-cannabis-cocaine-ecstasy-principale-drogue-vendue-france,https://www.20minutes.fr/societe/4189591-20251204-cannabis-cocaine-ecstasy-principale-drogue-vendue-france,0,www.20minutes.fr,"Cannabis, cocaïne, ecstasy… Quelle est la principale drogue vendue en France ?",Une étude du service statistique ministériel de la sécurité intérieure (SSMSI) a révélé mercredi les habitudes de consommation de drogue en France entre 2016 et 2024. Le cannabis reste le stupéfiant le plus consommé,https://img.20mn.fr/OZ66YZ5ARFqvGWKccdEjySk/1444x920_le-cannabis-est-le-principal-stupefiant-au-c-ur-des-trafics,2025-12-04T08:17:12Z,,Le service statistique ministériel de la sécurité intérieure (SSMSI) a publié mercredi un premier état des lieux de la consommation de stupéfiants en France. Si le cannabis reste la principale drogue… [+2624 chars],,fr,'France'
https://rmcsport.bfmtv.com/football/coupe-du-monde/tout-comprendre-comment-va-se-derouler-le-tirage-au-sort-du-mondial-2026_AV-202512040003.html,https://rmcsport.bfmtv.com/football/coupe-du-monde/tout-comprendre-comment-va-se-derouler-le-tirage-au-sort-du-mondial-2026_AV-202512040003.html,0,rmcsport.bfmtv.com,TOUT COMPRENDRE - Comment va se dérouler le tirage au sort de la Coupe du monde 2026,"Le tirage au sort de la Coupe du Monde 2026 a lieu ce vendredi (à 18h, heure française) à Washington, aux États-Unis. Ce tirage au sort sera le premier à 48 équipes, avec quelques subtilités. Explications.",https://images.bfmtv.com/cIaNjYNUeFi6k_jH0_YzBH3JvS8=/0x26:2048x1178/images/Le-trophee-de-la-Coupe-du-monde-lors-du-tirage-au-sort-des-barrages-le-20-novembre-2025-2190683.jpg,2025-12-04T09:09:00Z,,"Le tirage au sort de la Coupe du Monde 2026 a lieu ce vendredi (à 18h, heure française) à Washington, aux États-Unis. Ce tirage au sort sera le premier à 48 équipes, avec quelques subtilités. Explica… [+3503 chars]",,fr,'Cap-Vert'
https://www.numerama.com/sciences/2134743-catastrophe-pour-moscou-le-retour-du-soyouz-ms-27-risque-detre-lun-des-derniers-avant-des-annees.html,https://www.numerama.com/sciences/2134743-catastrophe-pour-moscou-le-retour-du-soyouz-ms-27-risque-detre-lun-des-derniers-avant-des-annees.html,0,www.numerama.com,Catastrophe pour Moscou : le retour du Soyouz MS-27 risque d’être l’un des derniers avant des années,"Alors que l’équipage du Soyouz MS-27 s’apprête à regagner la Terre ce 9 décembre 2025, l’avenir du programme spatial russe s’assombrit brusquement. En coulisses, une grave avarie survenue sur le pas de tir de Baïkonour menace de paralyser les lancements habit…","https://c0.lestechnophiles.com/www.numerama.com/wp-content/uploads/2021/11/soyouz-ms-18-iss-station-spatiale.jpg?resize=1600,900&key=1cab19c7&watermark",2025-12-04T11:17:18Z,http://web.archive.org/web/20251208214536/https://www.numerama.com/sciences/2134743-catastrophe-pour-moscou-le-retour-du-soyouz-ms-27-risque-detre-lun-des-derniers-avant-des-annees.html,"Alors que l’équipage du Soyouz MS-27 s’apprête à regagner la Terre ce 9 décembre 2025, l’avenir du programme spatial russe s’assombrit brusquement. En coulisses, une grave avarie survenue sur le pas … [+3334 chars]",,fr,'Moscou'
https://www.courrierinternational.com/article/sport-l-afrique-du-sud-et-le-rwanda-en-lutte-pour-accueillir-un-grand-prix-de-formule-1-et-bien-plus_238114,https://www.courrierinternational.com/article/sport-l-afrique-du-sud-et-le-rwanda-en-lutte-pour-accueillir-un-grand-prix-de-formule-1-et-bien-plus_238114,0,www.courrierinternational.com,L’Afrique du Sud et le Rwanda en lutte pour accueillir un Grand Prix de Formule 1… et bien plus,"Candidats favoris pour l’attribution d’un Grand Prix de Formule 1 africain, l’Afrique du Sud et le Rwanda entretiennent une rivalité qui dépasse le cadre sportif depuis de nombreuses années.",https://focus.courrierinternational.com/2025/12/04/0/0/8256/5504/1200/630/60/0/e8873b0_upload-1-ah5rl74i6ih3-068-aa-20112025-2526513.jpg,2025-12-04T11:31:18Z,,"Après trois décennies dabsence, la Formule 1 pourrait bientôt faire son grand retour sur le continent africain. Alors que le patron de la Formule 1, Stefano Domenicali, ainsi que des pilotes comme Le… [+1080 chars]",,fr,'Rwanda'
https://www.liberation.fr/international/amerique/coupe-du-monde-2026-comment-les-politiques-de-donald-trump-destabilisent-lorganisation-de-la-competition-20251204_7O7BCVOYEVHWNJ7U2HY2ZVAFRI/,https://www.liberation.fr/international/amerique/coupe-du-monde-2026-comment-les-politiques-de-donald-trump-destabilisent-lorganisation-de-la-competition-20251204_7O7BCVOYEVHWNJ7U2HY2ZVAFRI/,0,www.liberation.fr,Coupe du monde 2026 : comment les politiques de Donald Trump déstabilisent l’organisation de la compétition,"L’imprévisible président républicain, qui s’acharne contre l’immigration, les villes démocrates et ses pays voisins, affecte la mécanique d’ordinaire bien huilée du Mondial de foot, prévu dans six mois aux Etats-Unis, au Mexique et au Canada.",https://www.liberation.fr/resizer/v2/3OFB2AVRNNFURCADAKLWLNDOTU.jpg?smart=true&auth=b4b498ad8279ef18fae1b76f351c74fd7b65a3fbdc6db1fb270535b765630899&quality=70&width=1200&height=630,2025-12-04T11:47:07Z,,"Organiser un Mondial de foot nest pas facile, mais quand lhôte sappelle Donald Trump cest encore plus délicat. En juin prochain, les Etats-Unis accueilleront la Coupe du monde aux côtés du Mexique et… [+4202 chars]",,fr,'Mexique'
https://rmcsport.bfmtv.com/football/coupe-du-monde/coupe-du-monde-2026-decouvrez-la-composition-des-chapeaux-avant-le-tirage-au-sort-des-groupes_AV-202512040544.html,https://rmcsport.bfmtv.com/football/coupe-du-monde/coupe-du-monde-2026-decouvrez-la-composition-des-chapeaux-avant-le-tirage-au-sort-des-groupes_AV-202512040544.html,0,rmcsport.bfmtv.com,Coupe du monde 2026: découvrez la composition des chapeaux avant le tirage au sort des groupes,"À quelques heures du tirage au sort du Mondial 2026, la FIFA s’apprête à lancer une édition historique réunissant pour la première fois 48 nations aux États-Unis, au Mexique et au Canada. Entre un nouveau format, douze groupes à composer et un calendrier enco…",https://images.bfmtv.com/HwbrYHAbeZ42-nQaLZNvyc4K734=/0x13:2016x1147/images/Le-trophee-de-la-Coupe-du-monde-de-football-avant-l-edition-2026-2185322.jpg,2025-12-04T11:47:42Z,,"À quelques heures du tirage au sort du Mondial 2026, la FIFA sapprête à lancer une édition historique réunissant pour la première fois 48 nations aux États-Unis, au Mexique et au Canada. Entre un nou… [+2563 chars]",,fr,'Cap-Vert'
https://www.20minutes.fr/monde/ukraine/4189781-20251204-guerre-ukraine-trump-poutine-longueur-onde-enfants-camp-reeducation,https://www.20minutes.fr/monde/ukraine/4189781-20251204-guerre-ukraine-trump-poutine-longueur-onde-enfants-camp-reeducation,0,www.20minutes.fr,Guerre en Ukraine : Trump et Poutine sur la même longueur d’onde et des enfants en camp de rééducation,"« 20 Minutes » fait le point pour vous tous les soirs sur le conflit en Ukraine. Ce jeudi, Poutine et Trump ont échangé des amabilités, après l’apparent échec de la réunion au Kremlin",https://img.20mn.fr/-omXDsYjS6iciqjR_xExVCk/1444x920_in-this-pool-photograph-distributed-by-the-russian-state-agency-sputnik-russia-s-president-vladimir-putin-attends-a-meeting-with-belarus-president-in-bishkek-on-november-26-2025-on-the-eve-of-a-meeting-of-the-collective-security-treaty-organisation-csto-heads-of-state-council-photo-by-alexander-kazakov-pool-afp,2025-12-04T18:46:37Z,,"Vous avez raté les derniers événements sur la guerre en Ukraine ? 20 Minutes fait le point pour vous tous les soirs. Voici lessentiel de ce mercredi 3 décembre, au 1.378e jour du conflit.
Le fait du… [+3108 chars]",,fr,'Kiev'
https://www.lemonde.fr/afrique/article/2025/12/04/donald-trump-et-les-presidents-du-rwanda-et-de-la-rdc-signent-un-accord-de-paix-a-washington_6656044_3212.html,https://www.lemonde.fr/afrique/article/2025/12/04/donald-trump-et-les-presidents-du-rwanda-et-de-la-rdc-signent-un-accord-de-paix-a-washington_6656044_3212.html,0,www.lemonde.fr,Donald Trump et les présidents du Rwanda et de la RDC signent un accord de paix à Washington,"« Cela va être un grand miracle », a déclaré le président américain, qui a vanté, jeudi, un accord « puissant et détaillé ». D’intenses combats font toujours rage dans l’est de la République démocratique du Congo.",https://img.lemde.fr/2025/12/04/0/429/4644/3096/1440/960/60/0/623fa3c_ftp-1-slfjkolronzu-41678bfd2677475089113502e8a9800d-0-70a5670a310b411dbe587f7827435000.jpg,2025-12-04T20:27:39Z,,"Le président américain, Donald Trump, son homologue du Rwanda, Paul Kagame, et de la République démocratique du Congo, Félix Tshisekedi (de gauche à droite), à Washington, le 4 décembre 2025. EVAN VU… [+3735 chars]",,fr,'Washington'
https://www.liberation.fr/international/afrique/sur-fond-de-combats-meurtriers-le-rwanda-et-la-rdc-signent-un-accord-de-paix-a-washington-20251204_BVLIPXQCXFAU7LTHSA2CSZYIG4/,https://www.liberation.fr/international/afrique/sur-fond-de-combats-meurtriers-le-rwanda-et-la-rdc-signent-un-accord-de-paix-a-washington-20251204_BVLIPXQCXFAU7LTHSA2CSZYIG4/,0,www.liberation.fr,"Sur fond de combats meurtriers, le Rwanda et la RDC signent un accord de paix à Washington","Alors que les affrontements se poursuivent entre le M23 et l’armée congolaise, les présidents Félix Tshisekedi et Paul Kagame étaient ce jeudi soir en compagnie de Donald Trump pour parapher un texte en lequel seul le président américain semble croire.",https://www.liberation.fr/resizer/v2/WRCBAX4S2VDKLAFLI4VEF2TBRQ.jpg?auth=f87b06ffc1fb0c529a1d3d3329d4bd9c2c1d10653d8e192ef7c5b55978f093f1&quality=70&width=1200&height=630&focal=3420%2C601,2025-12-04T20:31:12Z,http://web.archive.org/web/20251205165430/https://www.liberation.fr/international/afrique/sur-fond-de-combats-meurtriers-le-rwanda-et-la-rdc-signent-un-accord-de-paix-a-washington-20251204_BVLIPXQCXFAU7LTHSA2CSZYIG4/,"Alors les combats font rage dans lest de la république du Congo, Donald Trump lassure : «Cela va être un grand miracle». A Washington, le président américain a présidé ce jeudi 4 décembre une cérémon… [+3730 chars]",,fr,'Washington'
https://www.ledauphine.com/defense-guerre-conflit/2025/12/04/un-accord-de-paix-entre-la-rdc-et-le-rwanda-signe-a-washington-alors-que-les-combats-continuent,https://www.ledauphine.com/defense-guerre-conflit/2025/12/04/un-accord-de-paix-entre-la-rdc-et-le-rwanda-signe-a-washington-alors-que-les-combats-continuent,0,www.ledauphine.com,Conflit. Un accord de paix entre la RDC et le Rwanda signé à Washington alors que les combats continuent,"Pour évoquer l'accord de paix entre le Rwanda et la République Démocratique du Congo, signé jeudi, Donald Trump a évoqué « un grand miracle ». Pendant ce temps, les combats faisaient rage dans l'Est de la RDC.",https://cdn-s-www.ledauphine.com/images/72E42C93-3347-48B6-879D-56BEFDCA20DC/FB1200/photo-1764881839.jpg,2025-12-04T20:57:00Z,,"Donald Trump a présidé jeudi à Washington une cérémonie de signature d'un accord de paix avec ses homologues congolais et rwandais, dans un bâtiment renommé en son honneur, parlant d'un « miracle » a… [+2591 chars]",,fr,'Rwanda'
